no,cid,text,image,pid,likes,comments,shares,post_time,scraped_at
60489,106889,"Humanity is seen lesser in society now, I was out with my grandma and my mum, who were both on their own wheelchair, with my sis and i pushing each of them.
We were waiting for the lift, and a family with a baby stroller, came and went straight into the lift that just arrived, even though we waited longer than them for the lift.
Then came two other people, an uncle and an aunty, who were both walking fine (no walking sticks whatsoever). My sis was going into the lift first, and she was trying to manoveur (??) her way into the lift, while I was waiting to do so next.
That aunty was already trying to get into the lift and passing me by to get into the lift, despite them arriving later than us.
When I pushed the wheelchair into the lift, she kicked the back of my shoes so you know she was definitely rushing to get into the lift. Like hello, yes the lift is for public use, but we have wheelchairs, and we arrived first, so what a normal person would do is to let us in first, and since we have wheelchairs, it is impossible for us to use the escalator instead.
Emphasizing on the fact that they were both walking fine, so they could have used the escalator instead, if they couldn't wait. Kindness is rare these days, and I truly appreciate and respect those who still carry kindness and humanity in them.
-
#106889: https://www.nuswhispers.com/confession/106889",,582047300616420,10,15,0,2023-03-10 22:09:37+08:00,2023-03-27 12:00:08+08:00
60512,106939,"What does it mean when he says he's ok if I date someone else, but he will feel a bit sian?
We've been dating for 6 months plus, our interactions and dates have been very fun and enjoyable. We always manage to talk through our disagreements in a cordial, calm, level-headed manner.
Bedroom play is fantastic and out-of-this-world too. We have a lot of chemistry in that area.
But he says he's unsure and also worried that he will hurt me. And he says he don't want to be possessive too. Someone told me that if the guy really loves you, he wouldn't want you to date another person.
What are your thoughts and perspectives? Should I move on and focus my energy and time on another potential?
-
#106939: https://www.nuswhispers.com/confession/106939",,590257389795411,9,49,1,2023-03-25 00:30:11+08:00,2023-03-31 12:00:10+08:00
60466,106830,"Asking for advice:
I've recently met someone through an interest group, we went out few times, I enjoy his company and have some very different feelings with him that I've never experienced.
We have very similar hobbies. However, I started to realize we have different life goal and as well as background, it'll be really hard if we are going to build our future life.
Am I being too realistic for thinking to put a stop now before our relationship grow deeper and hurt each other ultimately ? Am I thinking too far ahead? Or is it unfair for him if I still continue to hang out with him?
-
#106830: https://www.nuswhispers.com/confession/106830",,577248314429652,8,22,1,2023-03-02 23:34:02+08:00,2023-03-13 12:00:16+08:00
60523,106953,"I occasionally think of the cringe, mistakes, and ragrets in my life.
My recent coping mechanism is to think of my neighbour, who goes by the name of Amos Yee. Yes, the one who yeeted his chance at escaping Singapore for good by liking children a bit too much, and will be behind bars in many places for the forseeable future.
Get a D for Data Structures and Algorithms? There are worse D's he will be faving
Get a CU in Singapore: Imagining the Next 50 Years? I don't mind seeing you again, GES1035. Can't say the same for him and his prisonmates.
Get an F for Honours Thesis? There are worse F's for him than me getting this one.
-
#106953: https://www.nuswhispers.com/confession/106953",,593010546186762,8,8,2,2023-03-30 07:23:31+08:00,2023-04-04 12:00:05+08:00
60513,106938,"Hi just wondering if there's any interfaith marriage couple (especially between muslim and non muslim) out there willing to share your experience? Is it possible to build a family without forcing one party converting to another's religion?
-
#106938: https://www.nuswhispers.com/confession/106938",,590257439795406,7,15,2,2023-03-25 00:30:18+08:00,2023-04-03 12:00:16+08:00
60500,106915,"I wanted to add on to #106812 about fretting if a course is above one’s station. I know people doing computer science (CS) / pharmaceutical science (PHS) / Aerospace because they did well for A-Levels and chose to “upgrade” from whatever course that they wanted, only to regret later or even change course. To add insult to injury, those that stuck on may not get the high pay that they thought they would get.
Don’t be too hung up by the “prestige” or the IGP, focus on what you’re good at and what you love and. All the best!
-
#106915: https://www.nuswhispers.com/confession/106915",,585558250265325,7,0,0,2023-03-16 22:44:00+08:00,2023-03-23 12:00:26+08:00
60509,106930,"Never trust a fucking baldy who says that he’s trustable (no offense to bald people). But this A-grade asshole really deserves a special shitmeal because he is simply full of shit. I mean, the guy literally has the alphabets DICK in his name. Now for getting rid of snakes:
Snakes are a part of the world, and as such it is impossible to be completely rid of them unless you fortify yourself inside a solid bubble. The best you can do is keep your snake interactions at a minimum and keep any snakes as exposed as possible. Taking away the animal’s sense of security is part of the battle.
Next, how to trap snakes with a glue trap. Traps should be placed at vantage positions around the snake’s territory. Lure the snake inside through a specially designed opening. Once inside, the glue holds it firmly in place. What you do after is up to your own ethics. The downside is that you risk getting bitten.
So what would you do: avoid, expose or trap?
-
#106930: https://www.nuswhispers.com/confession/106930",,589052749915875,7,25,1,2023-03-22 23:29:52+08:00,2023-03-30 12:00:18+08:00
60503,106917,"Love screws around with your head.
I’ve sleep typed to my ex multiple times. I would send something kind and loving when I’m really tired and then I’ll doze off for a while in which I’ll have a short dream about how he either replied me (obviously doesn’t happen irl) or my message. This will jolt me awake and I’ll question if I have sent it and realise I did. This happens periodically when I’m so tired. Don’t think it warrants a block because I do feel a lot for him and only want the best so all the things I’ve typed subconsciously mean well. Ah tiredness is a no no.
If you’re reading this, love you lots. Sorry for the spam, though I mean what I said!
-
#106917: https://www.nuswhispers.com/confession/106917",,586968633457620,7,9,1,2023-03-19 08:47:11+08:00,2023-03-27 12:00:13+08:00
60476,106860,"@106823
Thank you for the kind words and encouragement. I feel I am in a better place after going through the constant transitions over the past few months. Many things have happened in my life. I lost some and gained some. It was a tough transition, as whatever had happened made me realize that I lost myself in the process while trying to chase or care for things or people that would somehow be only a phase in my life.
Some nights, I find myself tearing up to sleep or dazing while commuting to work and even at my work desk. I started feeling inadequate in every aspect of my life and felt that I had lost my self-worth. I had no one to talk to, and all I could do was look at inspirational videos or poems to pull me through. It took me a long time to regain my footing and finally start placing more focus on work.
I have no idea what is going on in your life now, but if you ever feel like you need to feel better, this is what I do: write three things about what you are grateful for at the start of the day, three things that you thought that you did well at the end of the day and three things you think you could improve on. Penning these thoughts has helped me look at things on the brighter side and reflect on my actions and thoughts. It also taught me the virtue of patience -i.e., sometimes, we can be mad and tend to be reactive fast. Instead, it enables me to reflect on my thoughts before acting in a way I would regret. If you feel like you need someone to talk to, I am always open for conversation to offer you a listening ear. As for advice, I think you are wiser than me haha.
Nevertheless, looking back, I would not blame anyone for whatever happened because I believe life has its way of teaching us lessons to grow us into a stronger, better version of ourselves. As you mentioned- tough times don't last; tough men do. Actually, this is one of my favorite quotes, when things get hard, to remind myself that if I could do it in the past, there's nothing to stop me from pulling it through now. Though I may no longer be as close to you as we used to be, I will still be happy and rooting for your future success.
P.s. Congrats on working through your uni phase and settling it through your saving and trading. I know there's no better feeling to achieve that sense of independence and fulfilment in the world. Jia you bah :)
-
#106860: https://www.nuswhispers.com/confession/106860",https://static.xx.fbcdn.net/images/emoji.php/v9/t4c/1/16/1f642.png,578400417647775,7,0,0,2023-03-04 21:29:59+08:00,2023-03-20 12:00:05+08:00
