no,cid,text,image,pid,likes,comments,shares,post_time,scraped_at
60475,106854,"no matter what I do, my mom is nvr happy
when I'm finding jobs, she keep saying why find so long? Alot of jobs should be very easy to find, dk what's difficult.
when I got an offer and shared the gd news with her, she just say the pay not even high enough and why took so long, nothing happy
I just want to share my happy news, but it seems she cannot be ever happy for me. My father, dont care. He just say ok, go work.
nvm, just envy those ppl w supportive parents that's all
-
#106854: https://www.nuswhispers.com/confession/106854",,577250774429406,35,27,2,2023-03-02 23:39:05+08:00,2023-03-13 12:00:24+08:00
60468,106836,"Feeling abit dejected tbh
heard of many cases, ppl from diff career paths, just took up programming themselves and manage to land high pay jobs in swe, like it's no big deal
then me, w cs degree, finding it difficult to find jobs, not even interviews
is the degree useless when coding can be picked up by anyone? Or do I lack the flair for it, and lag behind those who career transitioned and can pick up the skills needed for a job in a few mths instead of 4 years?
ppl make it seem like it is so easy to get a job even without qualifications, makes me doubt my decision of getting a cs degree
-
#106836: https://www.nuswhispers.com/confession/106836",,577248847762932,26,21,2,2023-03-02 23:35:23+08:00,2023-03-11 12:00:18+08:00
60479,106865,"Social media is ruining my gf's self esteem. How to ease her insecurity?
I'm with my gf for 2 years. We don't have any major issues other than the fact that she allows herself to be affected by what others post. Like people who post ig pics that they went to fancy restaurants and expensive holidays, indulging in branded bags and wearing luxury items. Posting as though they are living a fantastic life. I mean, I don't really care as I think most of these are superficial and fake and also attention seeking.
My gf on the other hand, will feel jealous and sulk when she mentions so and so just went to where and where. Like we are planning to see cherry blossoms this year. She is ok with that but asked if we can visit somewhere further year end. I know she has friends who can go on multiple trips in a year. But we only budget for one trip this year. I'm not saying year end I won't be planning anything but its likely we will not travel out for December.
She also told me her friends rents branded clothes and bags and asks me to sponsor her as a bday gift as she wants to try. I don't see the point. Its money spent but end of the day you own nothing. Only memories of the things worn if you had photos taken? I would rather we have a nice dinner and watch a concert.
She's starting to act like I should be more supportive of her wanting to match up to her materialistic friends which I don't think there is a need to. Both of us are earning a decent wage for our age but I think we are more on the thrifty kind of lifestyle. She does own a few nice and fancy items which I find it ok to treat ourselves once in a while. I just don't see the need to rent branded items and clothes.
-
#106865: https://www.nuswhispers.com/confession/106865",,579981017489715,26,62,8,2023-03-07 11:30:38+08:00,2023-03-15 12:00:20+08:00
60522,106936,"What is the purpose of life if all i do is work, eat and sleep? No girlfriend no friend no insterest always tired. No disire to know anyone from work. Is graduation the end of my life?
-
#106936: https://www.nuswhispers.com/confession/106936",,591546302999853,25,42,9,2023-03-27 11:50:08+08:00,2023-04-04 12:00:05+08:00
60521,106942,"Is it ok for guys to ask to split a bill after the first date if the girl declines invitation for a second date? I have been on 3 dates so far online, where there was no second date.
None of those girls initiated to pay and its abit costly to pay for 6 portions of meal when nothing materialises. Personally i feel its abit weird to ask for split after cause i assumed girls would at least pay for their share if they have no intention of seeing the person again.
Appreciate some feedback and opinion here :)
-
#106942: https://www.nuswhispers.com/confession/106942",https://static.xx.fbcdn.net/images/emoji.php/v9/t4c/1/16/1f642.png,591546229666527,24,76,10,2023-03-27 11:49:58+08:00,2023-04-04 12:00:05+08:00
60496,106902,"Everyone has read the news about salary increment for junior doctors but their working hours are horrific.
It's common to work more than 100 hours a week (a week is not a typo) with all the 32-hour on calls and they under report their actual working hours to not get flagged in the system since they are not remunerated for the extra hours anyway. The so called at least 1 day off in 7 days is non-existent because my husband has only gotten 1 day off out of 32 days (32 days is not a typo too) of continuous working.
Sometimes I wonder if my husband will die from overworking.
-
#106902: https://www.nuswhispers.com/confession/106902",,584614620359688,23,9,0,2023-03-15 07:30:32+08:00,2023-03-23 12:00:22+08:00
60516,106931,"I saw this guy at the golf course twice. The second time when he came, I dropped a note on his car telling him he’s cute. After that day, I have not seen him anymore till date.
To you- this probably will lead to nowhere but I have been thinking about you. The way you smile and how you played golf the beginner way but still full of smiles. I don’t even know if you are seeing anymore or even married but I am just attracted to how you carry yourself. I hope to talk to you in person the next time I see you at the golf course.
-
#106931: https://www.nuswhispers.com/confession/106931",,590258116462005,22,30,3,2023-03-25 00:31:26+08:00,2023-04-02 12:00:11+08:00
60525,106955,"Everyday I wake up and think, man I love Computer Science. I can’t wait to learn more about CS!
Studying CS has actually helped me improve my EQ. CS2030 taught me the notion of covariance and contravariance. A little further digging into the theory taught me that, property of an object can be studied by examining how other objects interact with it, such as by passing it into programs, and also by studying the inheritance structure of the classes that the object came from. Similarly, thinking processes of a people can be studied by examining how they with other people, and examining their performance in routines. These routines can be exams, group projects, internships, jobs, or anything really. We can also study their inheritance structures: In the case of studying people, it will be the environment that they grew up in that produced them, and how these environments changed over time. It could be their friends, family, schools attended, interest groups… anything that they interact or have interacted with on a regular basis.
Gaining EQ is like Dynamic Programming. Just store (memorize) the solution to previous subcases (past human interactions) and then find the DP relation to the next case (future human interaction). Of course, different problems will have different solutions and different DP relations. Moving from one DP problem to the next is akin to moving from one social structure to the next. There will be a different culture (DP relation) to get used to, and it can be uncovered by studying and memorizing a few instances of example interactions, (subcases) possibly between 2 other people not including myself, and then generalizing.
Complexity Theory was especially interesting. Interactive and Zero Knowledge Proofs taught me to think clearer about information being revealed in daily conversations. This helps prevent accidental self-doxxing online. It also helps in constructing politically correct, non-answers when faced with sticky and awkward questions. When studying derandomization techniques, I found out that most researchers today believe that BPP = P, meaning that all problems solvable by an efficient random algorithm also has an efficient deterministic algorithm as a solution. Extending this to observing people, I feel that the many seemingly random choices many people make are actually part of some principles that they live by.
This post was brought to you by: Poor CS student awake at 4am worrying about how to sell themselves out after graduation
-
#106955: https://www.nuswhispers.com/confession/106955",,593010816186735,22,7,4,2023-03-30 07:24:05+08:00,2023-04-04 12:00:05+08:00
60506,106924,"Currently a student in Finance, working in a MNC.
I have been holding this annoyance for a while and wish to get it off my chest and gain some opinions. I felt that I was wrongly blamed.
I have recently joined a new company and I’m the youngest. My team consist of about 8 of us and most of them are in their mid 30s.
2 weeks ago I was tasked to choose a place for our team lunch. It is a tradition where the youngest usually is the one choosing the place. I was given less than a day to think.
It is known that there are quite a few factors to consider:
1. There are 3 lacto-vegetarians in my team. As such, the restaurants need to have vegetarian options.
2. We worked at Buona Vista and our lunch need to be quick as we have important work to finish. This also means it needs to be nearby. For dinner, there must be additional of alcohol as we have heavy drinkers in the team.
3. The ambience must be pleasant and nice. No coffee shop, no rundown places.
4. They want a generally expensive place. (It is known as they are quite well-to-do individuals). They won’t settle for coffeeshop. FYI, our first team dinner when I joined the company was for 8 pax at Artemis and we spend close to $2000 for it. The company paid for it.
I tried finding around Holland Village for a restaurant with vegetarian options as it is fairly close-by and there are a few restaurants there. I found this western and Italian place with vegetarian options and suggested it to my director. Him being a vegetarian himself looked through the menu and agree to it saying “There are quite a lot of vegetarian options and ambience is okay.” I gave the menu and restaurant name to the rest of my team and they all looked through it. Pizza, pasta and some tapas are the vegetarian options.
Fast forward: After we had our lunch at the place, I overheard another director (he) and colleague (she) talking bad and laughing about the place, saying “Pizza and bread for lunch?! Hahaha.”
Shortly after I conversed with them and came to know that they don’t see pizza as a proper food item, but rather a side dish. There was no direct confrontation but just some sourness during the conversation.
I was fairly offended after. There was no direct confrontation but it still left me quite confused and angry.
For myself, I didn’t come from a very well-to-do family and I’m okay with pizza for lunch. I wouldn’t even mind going to a coffeeshop and just have noodles and rice.
My family don’t have a high status in society, just an average Singaporean. The most expensive food meal I ever have and paid myself is probably just kbbq that cost around $30+.
This is why I went an extra mile to provide them with the menu to see if they are okay with the food but the result wasn’t what I expected. There were no direct objections at the start and I thought they are totally fine with it. After getting negative gossips behind my back over this makes me feel upset.
What do you think? If it is you, would you be upset?
-
#106924: https://www.nuswhispers.com/confession/106924",,586968963457587,20,60,4,2023-03-19 08:48:31+08:00,2023-03-27 12:00:16+08:00
60470,106844,"What's with all those jobs, entry level, junior positions, still need 2-5 years exp, some even state outright PROFESSIONAL WORKING EXP
dk where the exp comes from, dejected ngl
-
#106844: https://www.nuswhispers.com/confession/106844",,577249794429504,20,8,0,2023-03-02 23:37:03+08:00,2023-03-11 12:00:21+08:00
60528,106959,"Soooo, it's my third-year of medical school and my first actual year of clinical exposure (where we get to the hospitals and stuff; there's three years of clinical rotations here in NUS before we can gradute from medical school). And I'm feeling really stressed. Not just because the final exams are coming soon (just over a month later in the first week of May), but also because I find that with so much time spent on studying, there's not much left for things like exercise, my previous hobbies like netball, and dating. So sick and tired of medicine.
Don't wanna use dating apps because of the stigma. It's a last-resort as I have heard horror stories from that. Pretty sure I can meet guys irl first?
Currently single (for 2+ years) ever since I broke up with my first bf from JC, and keen on dating. What do you all think of the idea of dating a batchmate from my cohort? I feel like with dating a batchmate, since we'd have a lot in common and we can probably relate a lot to each other. But I don't know anyone else apart from my CG (clinical group).
I have a secret fantasy about dating an older guy too, so, hmm... I imagine that most of the guys in my batch are my age cos of army disruption, but I think that there should be a few who had completed NS first. There're also some who transferred in right?
Too bad I'm not chio la. Just a 5/10 (prob 6.5/10 with good makeup) plain Jane, and never had a guy confess enthusiastically to me before. If only there were a way for me to meet more my batchmates... I secretly want a cute oppa batchmate to confess to me hehehehe
-
#106959: https://www.nuswhispers.com/confession/106959",,593011352853348,20,12,5,2023-03-30 07:25:10+08:00,2023-04-04 12:00:05+08:00
60504,106921,"Brothers and sisters, help me out here. There is this creep who I've met during orientation and he followed me on Instagram. He doesn't post on his account, but I always see that he views all my instastories and likes most of my posts. He's fat and ugly and I heard from my friends he's a loner and probably has been single all his life. This has been going on for a few months now. I'm quite a small build and I'm worried that he is stalking me and will force himself onto me. What do I do? I feel very unsafe when alone in school as I don't exactly remember his face other than he's fat and quite tall.
-
#106921: https://www.nuswhispers.com/confession/106921",,586968773457606,19,87,15,2023-03-19 08:47:49+08:00,2023-03-27 12:00:14+08:00
60492,106894,"Can the students in PGP PLEASE STOP STEPPING ON THE TOILET SEAT COVER. Lots of toilet seat covers are broken each month and I have come to notice. They will leave their footmarks on the seat cover, it’s so unsanitary! Idk which kampung you guys come from but please. Just sit your butt down!
-
#106894: https://www.nuswhispers.com/confession/106894",,582837110537439,18,29,6,2023-03-12 08:09:15+08:00,2023-03-20 12:00:20+08:00
60511,106934,"DONT COME TO ARCHI!!!!! PLEASEEEEE!!! FOR UR OWN SANITY SAKE
-
#106934: https://www.nuswhispers.com/confession/106934",,589053049915845,17,4,1,2023-03-22 23:30:28+08:00,2023-03-31 12:00:09+08:00
60501,106916,"""You failed to fix the router, please drop out of NUS please""
- My mom to me (Mech Eng Student)
-
#106916: https://www.nuswhispers.com/confession/106916",,585558280265322,17,11,3,2023-03-16 22:44:05+08:00,2023-03-24 12:00:21+08:00
60477,106862,"When I say that I like a really good girl, my friends say this to me, ""She is out of my league. She is too pretty, smart and her personality is great. She will have more options and she won't even consider you. You need to lower your expectations bro.""
I hate this line ""please lower your expectations"".
I only have one question to everyone, ""How do I get into the same league or a better league than great girls?"".
What should I work on?
What makes someone attractive despite their disadvantages?
Please share some actionable steps.
If you believe that I should just look for someone within the same league or that I cannot improve myself, then I think you should not read further.
Here is a little background about me:
I am kind of on the lower end for looks because of a specific health condition.
I also have a background which is a little disadvantageous and people constantly look down me.
These are issues I have no control over.
I don't want to lose out because of things that are not in my control.
This is not even my fault.
No one, from my friends to relatives, believe that I can get someone good in my life.
Here are things I am already trying to do:
I am already going to gym to get into shape. Due to an injury in army, I cannot get into an ideal physique but I try to get as close as I can.
I am working in an average but meaningful job. I have worked extremely hard and have made some achievements there, even been featured .
I have also worked on my social skills (reading books, watching videos) by trying to be more funny and actively listening to people to have more meaningful and deeper conversations.
Despite all my effort thus far, I am still not going any further.
Dating apps are brutal because they are 80% based on looks (no matter what I write on my profile) so I get practically no matches.
I have tried physical dating events and have had some slight success. The girls say that they enjoy the conversations with me but they don't want to be romantic partners. Some even offered to be friends.
I have no idea where I am screwing things up. Things seem to keep repeating.
I am still in a league below them. I am not sure how to climb up further.
If you have any tips, please do share.
Thanks!!!
-
#106862: https://www.nuswhispers.com/confession/106862",,578400567647760,16,43,2,2023-03-04 21:30:16+08:00,2023-03-15 12:00:20+08:00
60474,106852,"School of Computing has the worst WiFi, shocking since you expect them to have the best WiFi. Seems like they run separately from the main NUS network.
-
#106852: https://www.nuswhispers.com/confession/106852",,577250461096104,15,9,0,2023-03-02 23:38:25+08:00,2023-03-11 12:00:24+08:00
60488,106882,"My greatest regret was losing her
I thought she would come back to me, considering how we have great moments and memories together.
I went on an overnight trip with a female friend without telling her. She was just a female friend and nothing more.
When she found out, I was pissed that she didn't trust me and wanted to break up with me. We were together for almost a year. I thought she overreacted.
It's been 11 months since she left and I still cannot forget her. It seems like she has met someone new. I really regret not apologising and trying to win her back but it's too late.
I dated several girls but I don't have the same frequency or chemistry with them. I keep thinking of you every day and every night.
XY, if you're reading this, I'm sorry to hurt you and not think from your POV. I'm envious of the guy who now receives all your love... Your random handwritten notes, the way your eyes light up when you are surprised or happy, your adorable laughter and the way you hold onto me when we sleep. I miss your cooking and I miss you very much. Although I wish you happiness, I really wish I was the reason to make you smile and laugh again. Ilyvm and I'm sorry.
- AB.
-
#106882: https://www.nuswhispers.com/confession/106882",,582046727283144,14,28,10,2023-03-10 22:08:19+08:00,2023-03-24 12:00:12+08:00
60526,106956,"I think I'm addicted to going to asian massage parlours.
It all began a year ago during winter break. I was bored and had wanted to try something new and decided....why not? People online kept recommending against it because you'll feel worse afterwards. They were right. After the first time, I felt bad immediately and sworn that I'll never go into another massage parlours again.
A few months passed and I decided to go into another one again... and another one...and another one
I am currently on exchange and have already visited three in the span of 3 months. Don't get me wrong, I have good interactions with my current roommates and we do lots of activities and go on adventures together. I have enough course work that makes me busy and engaged. However, something just makes me want to visit one again..
I want to stop it. Please send help and advice
-
#106956: https://www.nuswhispers.com/confession/106956",,593011026186714,13,31,13,2023-03-30 07:24:24+08:00,2023-04-04 12:00:05+08:00
60467,106834,"What we need is not web3 but Half Life 3.
Change My View.
-
#106834: https://www.nuswhispers.com/confession/106834",,577248771096273,13,3,2,2023-03-02 23:35:13+08:00,2023-03-15 12:00:14+08:00
60493,106892,"I really hope I don’t come off as entitled but I’m just trying to make sense of the situation. I’m a final year student and I’m about to grad this sem. Trying to sign on to army but whenever I express interest MINDEF keeps rejecting my application without an interview. Does anyone know what could possibly put me in a position of auto-rejection? Grades are average, very good performance during NS and no criminal record.
-
#106892: https://www.nuswhispers.com/confession/106892",,582837633870720,12,27,1,2023-03-12 08:10:56+08:00,2023-03-24 12:00:15+08:00
60478,106864,"Hi yalls, 24M here, will graduate uni next year. TLDR, I wanna know what y'all think of someone getting a BTO/resale flat with his single mother. Reasons: we do not own a flat, and we currently live in a 1-bedroom rental flat.
I do plan to get married in the future, but I'm not currently dating, and at the rate that I'm going I'm probably going to be single for a while, 'cos I'm just constantly doing internships and studying so I don't actively meet anyone.
So, my parents divorced when I was 1yo, and never really had much contact with my father. Due to certain reasons, my mom lost the matrimonial home and we've been staying in a rental, 1-bedroom HDB for a few years now. (I have an elder sister but she has married out so she's kinda out of the picture)
I have thought of renting a place when I graduate but I don't feel good about spending close to 1000 a month on rent, but yet I can't seem to be satisfied with sleeping in the living room for the next few years. And hence I've thought about this. (My earning potential is around 5k-6k/mth as a fresh grad, and hence the downpayment amt isn't really a concern as long as I have 1 or 2 years.)
But then this does still raise a few concerns, right? For the ladies, would you be okay with settling down with someone like me, knowing well that you won't be able to do the conventional BTO, or maybe even the fact that you might have to live with your mother-in-law? If anyone else had been in a similar situation, would appreciate it if you could share ur pov! Thanks.
-
#106864: https://www.nuswhispers.com/confession/106864",,579980960823054,12,28,1,2023-03-07 11:30:27+08:00,2023-03-20 12:00:08+08:00
60532,106966,"Seriously there's this inconsiderate group of people in the PGP study rooms that are always talking and will only stop if I tell them to it's so annoying to have to tell them off every time when there's clearly a sign on the wall saying ""quiet area"" and it's alway the same people. They'll also shift the tables around like it's their own home. How do I deal with this kind of people
-
#106966: https://www.nuswhispers.com/confession/106966",,593012946186522,11,9,1,2023-03-30 07:28:44+08:00,2023-04-04 12:00:05+08:00
60519,106948,"I look like a small boy with baby face. I have a small build and many mistake me as a kid. But I am actually 2 years older than my peers in school.
I think it comes with many perks. I get away stuff because of my petiteness no one treats me seriously, and I get a lot of girls attention and I flirt with them a lot, sometimes sexually. I get away from it a lot maybe they don't find it uncomfortable due to my size???
But the thing is that I have not revealed my age to my peers so they think I am the same age as them.
What should I do? Should I tell them my age or what?
-
#106948: https://www.nuswhispers.com/confession/106948",,591545576333259,11,38,3,2023-03-27 11:48:13+08:00,2023-04-04 12:00:05+08:00
60508,106928,"Should I bring up with my boyfriend because he homophobic?
I have a few closeted lgbtq+ friends and am also consider myself to an ally of the community. However, my boyfriend of two years isn't and he thinks it's unnatural. So much so that he sends me shorts with anti-Lgbtq rethoric. I feel really conflicted when he sends me things like that.
After talking with him to understand where he comes from, it just came down to that we have different viewpoints. I guess Im just seeking advice as to is it really worth sticking it out. I sort of rationalize it by telling myself that a lot of people in Sg are still pretty conservative.
I haven't told any of my other friends about his viewpoints. And honestly apart from this, I am really happy with him. And it only comes up occasionally. I guess I'm really just seeking advice, as to is this really something that one breaks up over? Can it change in the future?
-
#106928: https://www.nuswhispers.com/confession/106928",,589052346582582,11,35,7,2023-03-22 23:28:59+08:00,2023-04-02 12:00:04+08:00
