no,cid,text,image,pid,likes,comments,shares,post_time,scraped_at
60296,106497,"I was just 17 years old when my life fell apart. It all started with my first boyfriend. He was my age, and we had been dating for a few months. I thought he was the one, but I was wrong. He got me pregnant twice and I had to get abortions both times. It was a difficult and painful experience, but I thought it was all worth it for love.
My second boyfriend was 9 years older than me. I thought he would be more mature and responsible, but he ended up being just as bad as my first boyfriend. He was controlling and manipulative, and I couldn't get away from him fast enough.
My third boyfriend was only 5 years older than me, but he was the worst of them all. He played me like a fool and left me feeling used and worthless.
I was so focused on my relationships that I neglected everything else in my life. I used to vape and smoke a lot, and it affected my studies. I did very badly for my O levels, only getting 39 points. It was a far cry from the 213 points I got for my PSLE. I was in Secondary 5 when I took my O levels, and everything went downhill from there.
I was a Chinese girl and I thought I was fairly good-looking, but it didn't seem to matter. I thought that love would be the answer to everything, but it only brought me pain and misery. I couldn't help but feel like my life was ruined. I felt like I had nothing left to live for.
I used to be such a hopeful and optimistic person, but after all that had happened to me, I couldn't see the point in anything anymore. I felt like I was just a shell of my former self, and I didn't know how to move on.
I couldn't help but blame myself for everything that had happened. I thought maybe if I had made different choices, things would have turned out differently. But it was too late for that now. I was stuck in a cycle of regret and self-loathing, and I didn't know how to break free from it.
I wish I had known then what I know now. I wish I had realized that love isn't always enough, and that you have to take care of yourself first and foremost. But it's too late for me now, and I'm left to pick up the pieces of my shattered life.
-
#106497: https://www.nuswhispers.com/confession/106497",,8561045643965821,157,184,40,2023-01-17 21:25:35+08:00,2023-02-03 12:00:18+08:00
60259,106402,"I feel depressed because I was rejected by a girl on a personal level, most likely due to my financial background.
So I’m a guy, fresh into uni and new to relationships. Last semester I somehow get the courage to ask out this girl in the same year as me. Long story short, we hit off very well. We met up 5 times over a month, most times for an activity and not just a meal. On the 6th meeting, I sense the vibe is strong and I confess my feelings for her.
Up to this point I’m 100% confident she likes me back. But then to my utter surprise and horror, she says, “let’s just be friends, I’m not really into dating.”
I’m taken aback and I ask her why. She is surprisingly amiable and she takes some time to explain that it’s nothing to do with me but her, that she’s ‘just not into dating’ and doesn’t feel the need to get into a relationship. She also claimed that she honestly thought all those outings were just as friends and she didn’t know they were intended to be dates and apologised if she sent the wrong signals.
Regarding the “I just don’t want to date” line, I’ve heard countless times before that such rejections are actually personal. On NUSWhispers and also among my friends, there’s this saying: When a girl says she doesn’t want to date at all, she’s just trying to let you down easy, but actually she just doesn’t want to date YOU personally.
It's basically common knowledge.
Knowing the rejection was personal was so depressing. I suffered a mental breakdown over the next few days. It hurt like hell and got me agonising over what part of me is so bad. Some part of me must be so repulsive that I would get rejected on a personal level, especially with that cliché excuse of “I’m just not looking to date”. This excuse that covered up an unknown reason pained me to know that I had some personal problem that was so severe the girl must have deemed too hurtful to say out.
I agonised over why she didn’t like me. I narrowed it down to the 3 main common reasons: looks, education level, or financial status.
Now I know there could be other reasons, such as not feeling a romantic connection, incompatibility or mismatched personalities, which are completely possible and valid reasons for rejection, but I don’t think that’s the case here, otherwise the girl could have just told me she felt we didn’t click / were not compatible / I'm not her type; and such reasons are good and not hurtful at all. Furthermore we went out so frequently. Since she used the “just not into dating at all” excuse, she’s most likely lying to hide a deeper reason, and is trying to be nice because the real reason could be too hurtful for me to bear. So I think the reason is unlikely to be incompatibility or mismatched personalities, not least also because we shared a lot of similar hobbies like painting, music, etc. to name a few.
So such a hurtful reason has to be either looks, education level or financial status (I can’t think of any other reason too hurtful to say out).
I agonised for weeks after that, wondering what was wrong with me. It sure as hell cannot be education level as we were in the same year and taking the exact same course, down to the same minor. We both said we were aiming to continue doing a masters after our degree. As for looks... it’s very unlikely to be my looks as we went out multiple times. Also my friends all agree she was within my league in the looks department. And she was shorter than me.
So, that just left financial status.
As full time students who are not earning a steady income of our own yet, I once thought financial background didn’t matter much as long as I was still decently dressed and able to pay for dates. After all, we were in the same course, and it should be our future prospects that mattered more, right? Apparently, not in this case. I got the feeling she’s from a richer background than me and she probably realised it too. Because through our conversations, I found out she attended an expensive private high school, lives in the central area of a major city (she is a foreign student btw), and travelled to more Western countries than me. Doesn’t take a genius to figure out who is from a more well-off background. To clarify, I’m definitely not poor, I’m middle class. I don’t have student loans and both my parents work decent white collar jobs, but my background is definitely not as wealthy as hers.
And I’m pretty sure she knows I’m middle class because she asked what my parents were working as, and also asked what countries I’ve been to. And yes, I also paid for some of the ‘dates’ at decent eateries. But perhaps her financial standards were just too high.
Now I’m not saying that girls are gold diggers, but I heard that even in todays day and age, well-off women with their own money still want to date guys of equal or higher financial background compared to them, not because they are gold diggers and want the guy’s money, but simply because a higher financial status makes one look more successful and attractive overall.
So yeah, the girl most likely lied that she’s just not into dating to hide the hurtful truth of what she truly felt, that she thought my financial status was too low for her. Furthermore she is a foreign student from a country whose citizens have a reputation for being highly materialistic and judging others based on financial background. Deride me all you want for stereotyping or generalising, but like I mentioned earlier, rejection based on financial background seems most plausible. Furthermore, I have friends from that particular country who always specified that whenever girls from their country say “its not personal, I just don’t want to date in general”, the rejection is in fact personal and the other party is bullshitting.
So yeah, it has to be financial status. The only reason that is both personal and too hurtful to say out. Either that or there’s something else so repulsive about me that I’m hit with that cliche excuse.
And now I'm hurt like shit. Especially because of that girl's excuse.
Even if you don't agree with my assessment on it having been due to financial background, you can't deny that the rejection was personal towards me, and some part of me must have been so repulsive to the point she would use that 'not into dating at all' excuse. Either way, the rejection sure was personal. And the reason hurtful and terrible enough for the girl to use that cliche excuse.
So this happened months ago, but I still feel pained by it. Sucks to be rejected on a personal level, and judged for your financial background. My self esteem has been shattered and I am depressed. Trying to get this off my chest before the next semester…
-
#106402: https://www.nuswhispers.com/confession/106402",,8518641328206253,58,360,40,2023-01-09 15:44:39+08:00,2023-01-21 12:00:28+08:00
60536,106970,"As a guy, if im going out with a girl with good assets or her daddy with connections in high places, then i will offer to take the bill, cuz I need to demonstrate that I’m sincere.
However if im going out with an average looking girl or a girl with no family background, then i will prefer her to split the bill. Coz I can always find a replacement.
I’m cognizant of the fact that the world is competitive and I need to take advantage of anything available in my vicinity. It is important for me to maximise my gains.
Gotta have that grinset. I’m not being materialistic, I’m just being practical.
-
#106970: https://www.nuswhispers.com/confession/106970",,594858662668617,117,103,40,2023-04-02 17:37:14+08:00,2023-04-14 12:00:15+08:00
60595,107089,"22F and the dating scene makes me despair.
Me: 22F, active lifestyle, all sorts of hobbies ranging from trading card games to martial arts, lowkey chatterbox, honours year NUS student.
My standards: decent shape, has hobbies and interests he is able to talk about, and is in a position that I'm not likely to be the main breadwinner in the long run. idgaf if he's a poly grad with a side hustle, another student in my faculty, a fresh grad with fresh grad pay, whatever. Have something going on.
I am very very lucky if I can find someone who even hits 2 of those. Went on so many blind dates. One of the better dates was another TCG nerd who I could talk with all night, but wasn't physically attractive for me - alamak, what to do, close two eyes also cannot.
Then got the prettyboys who have interests but cannot talk.
Then got those who cannot present themselves well, but can talk... however, it is only about work.
Then finally got the legend that looked 46 years old at 26, insulted the disabled waiters - in one of those 'manned only by the disabled' cafés - within 5 minutes of sitting down, insulted me within 20 minutes of that, and blamed immigrants for him (poly dropout with no interest in upskilling, no side hustles, and clearly no ability to remove his foot from his mouth) earning $2k/month. WTAF?
Alamak. Men, take comfort that no matter how bad you think you might be, you're probably not stupid enough to insult the disabled waiters during a blind date.
I'm sure most SGean men are not like this, but the sheer amount of nonsense I have to filter through makes me want to give up and start looking into adopting a few cats. I'll be the crazy cat lady with a bottle of wine and a sick card collection that is singlehandedly paying a game store's rent, idgaf.
-
#107089: https://www.nuswhispers.com/confession/107089",,603847541769729,170,163,38,2023-04-18 15:03:30+08:00,2023-05-06 12:00:05+08:00
60480,106870,"Should I break up with him?
I have changed the story substantially to protect my identity but the advice will apply to my situation.
I met a guy during my first year. He was in his first year of medical school and I was in my first year of accounting. We hit it off right away. We shared similar tastes in food, in movies, in hobbies, we even took the same third-lang in secondary school. We've been dating for more than 8 years now. We don't fight, we always spend time together. Everything is better than I have ever imagined when it's just the two of us.
Recently we've been talking about marriage. It would have been a no-brainer for me to marry him were it not for this weird philosophy that he has about our responsibilities as spouses. He believes strongly that he is marrying me and not my family and likewise I am marrying him and not his family. According to him, I will be exempted of all my obligations to his family if I so want to be, and he should be given the same privilege. This, apparently, isn't just his idea. His whole family thinks this way, even his parents. His mom sat me down once to tell me that while I am always welcome, I will not be expected to do anything and she hopes I don't expect her son to do the same. One detail. Both his parents are doctors and they own and run a specialist clinic together. My dad is a taxi driver and my mom is a homemaker.
My mom and dad have been giving me pressure to soldier on with the marriage and they have indicated to me that they plan to ask for an obscene 5-figure amount in dowry and more than half of the banquet seats. His parents have also spoken to me and they said they will not be participating in any tradition, and all costs for the marriage will be borne 50/50. It's probably worth noting that my boyfriend's family do not celebrate any festivals (not Christmas, not CNY) and they are passionate atheists. I am pretty indifferent about my family's traditions but I don't know if I'm willing to get into a fight with my parents over what will come across as blatant disrespect. I also feel uneasy that my boyfriend does not believe in helping out with my duties to my family. One reason I want to marry is the fact that there are many challenges in life that are just easier to take on with help, most of these challenges involve my responsibilities to my family. I have a brother who is unfortunately autistic, and another brother who has a juvenile record and recently got a baby but refuses to work. He had this baby with a girl out of wedlock and now all of them are living in my parents' three-bedroom apartment. Most of the money I earn helps pay for all the problems that keep happening in my family. I don't like that I can't catch a break either. But it doesn't feel right to renegade on my family even when they are clearly suffocating.
I was fortunate enough to have had financial aid through the very elite schools that I grew up in. My friends are all from upper middle class families and I have spoken to them. Apparently they were quite uniform in their inability to support me on this issue because they also believe that it would be difficult for them to want to marry someone if they didn't first have assurances that their lives wouldn't be made more difficult post-marriage. In other words, most of them took the side of my boyfriend.
Am I the weird one to be expecting my future husband to share my burdens, however heavy they are? If I go through with this, I'm afraid of how ugly things can get with my boyfriend's family being of a completely different culture to mine. But if I do not, I don't know there is a guy out there that exists that I get along with while still being willing to support me.
-
#106870: https://www.nuswhispers.com/confession/106870",,579981367489680,68,131,38,2023-03-07 11:31:25+08:00,2023-03-15 12:00:20+08:00
60262,106407,"For the guys out there who have never been in a relationship or dating before, as a guy myself (25 yo, NUS alumni), I want to share on some important notes before you start dating or a relationship.
1) Actions from girls are more important than words. Yes, a girl may claim she misses you, text you good morning, say will bring you you to xxx, say will do xxx. If they are just saying without any actions done CONSISTENTLY, then it is just plainly talking.
2) Please don’t accept a relationship just because you are afraid to be alone or already in the so called “typical age range to get married” or most of your friends are attached. Rather to be alone than to be in a relationship/marriage suffering!!
Side track: according to book I read, the most important things in life for a guy are:
A) Health
B) Own savings
C) Family and Guy Besties (see girl is not in the list)
3) Watch out for her body language. If a girl CONSISTENTLY:
A) Keep her phone/phone screen away from you
B) Disallow you from using her phone
Explanation for A and B: she does that because she has something fishy to hide.
C) Never want to put your couple picture as her dp or post on social media or even discourage you to do so. Delete your couple photos on her phone.
Explanation for C: She considers herself to be in the “spinster” market. Means she is still looking around for her partner or even scared of people seeing you two together.
D) Always talk about herself and rarely entertain you
Explanation for D: One sided. She only want companionship. There should be give and take.
E) Always online on WhatsApp/Telegram but take 10000 years to reply your messages
No need to explain you should know why.
F) Say “none of your business”.
This is a major red flag. In a relationship, you all are supposed to work and listen together, not one don’t care about the other.
G) Don’t know what she wants in a relationship. Even after months.
H) Flirting and Cheating. When someone flirted and cheated although she has you, it means that your relationship is not that strong enough to begin and typically she will not suddenly change her heart overnight. So please do yourself a favour to distance away from her. Why tolerate someone like that?
I) Always texting a lot of male friends. Go to male friends’ house alone and not with a group of people.
J) Not willing to fork out money for meals/trips on YOU. If a girl is cash stripped because of her family situation (eg. Take care of family/pay loan/debt), it is understandable. Otherwise, the typical girl will always have more than money to spend on you on meals. Imagine a girl having difficulties parting with her money at the dating stage/while in a relationship, and imagine if you were to have kids with her, she definitely want you to spilt/pay for the hospital bills and baby accessories expenses. Would you ever want that?
Side note: a typical girl will chat with more than one guy online/in person. Please keep your eyes open and don’t put 100% heart into the relationship unless you feel reciprocated. Otherwise you will get hurt.
4) I suggest men to watch videos from Andrew Tate YouTube Channel (yes I am a fan of him). From his channel, I learned that a girl who truly wants to be with you would put 100% effort and her heart to be with you. She will be willing to spend money and time with you. No excuses. No mind games. You will be her priority other than her job.
Thanks for reading up to here :). I have been in the above situations blindly until I woke up finally. It has been very heartbreaking for me since I put my 100% heart into it. I cried a lot and felt depressed and I am recovering from it now. At least I am thankful for recognising it at the start of the relationship.
iykyk ;)
-
#106407: https://www.nuswhispers.com/confession/106407",,8518645858205800,75,85,37,2023-01-09 15:46:23+08:00,2023-01-19 12:00:55+08:00
60840,107643,"Hi, I'm looking for some advice. I'm going on my first staycation with my new boyfriend this weekend. We've been together for about 2 months and this is the first time we will be intimate. All throughout my life, I've worn highly padded bras. I'm in between an A and B, but I've been doing this so long that I know how to make my boobs look like a large C or even D. I know my boyfriend likes it because he's complimented me a couple of times. This weekend, however, I'm afraid that my boyfriend will be disappointed when our clothes finally come off. I really like this guy and don't want to upset or lose him. What should I do?
-
#107643: https://www.nuswhispers.com/confession/107643",,659736506180832,61,185,36,2023-07-19 12:33:05+08:00,2023-08-17 12:00:32+08:00
61118,108225,"I need to confess...
I met my wife 5 years back ago, when we were about to graduate. The first time I saw her, I told to myself ""She's the girl I want to marry. She's the girl I want by my side. She's the girl I want to protect."" But she was taken at that time.
A part of me felt so lost and wanted her so badly. A part of me felt I shouldn't disturb her and I should move on. I couldn't. So I stalked all her social media, be friends with her friends and got introduced as a ""mutual friend"". When we officially met for the first time, things were already not looking good between she and her boyfriend at the time. I took my chance to fill his spot and constantly gave her my support, my love. And eventually, she fell in love with as well. She decided to break it off with her then-boyfriend, although she didn't know I knew everything about her prior beforehand thus I was able to be the perfect listener for her. 
As we got together and with marriage coming into my mind but she was still not ready, I did a bold decision. I babytrapped her on purpose as I thought, ""with our kid, she will be with me forever. She will never leave me and she HAS TO marry me"". In the end she was furious when she got pregnant, but quickly let go of the issue as she thought we are both responsible. 
Flashback to now looking at our 3 years old daughter and her, she's still the same girl I want to take care for the rest of my life. Although we are financially stable and have a happy family right now while even waiting for our BTO, I feel so extremely guilty. I felt she will hate me, if she knew what really happened. I know I will probably take this secret to my grave, although I will have to carry this guilt for the rest of my life.
I'm sorry, but I love you too much. I know I was selfish, but I will spend the rest of my life making up to you.
-
#108225: https://www.nuswhispers.com/confession/108225",,726627832825032,127,68,35,2023-11-17 07:31:28+08:00,2023-12-03 12:00:10+08:00
60934,107857,"Anything I need to know before marrying a Malaysian?
She is from JB and went to RGS when she was 13. Before that she went to several international schools all over the ASEAN region. NUS Med. I’m NUS Med too. Accent is indistinguishable from any Singaporean I know. Maybe a bit too atas but I don’t know if it’s because of RGS or because she’s from a really rich family in JB. Also my father is a taxi driver so I’m not exactly in her class. 
Her father owns 80% of a listco in Malaysia. Yet, very humble (almost cheap) family. Her father drives a 20-year-old Camry and refuses to buy a new car before his current one breaks. He does go all out in certain things, particularly education of his children and real estate. She has a paid-off 3-room condo to her name in Holland Village that her father bought for her. My girlfriend is also cheap. She thinks traveling for leisure is a waste of money, thinks Starbucks is a waste of money etc. Every time I meet her she would find a way to say something is a waste of money. I don’t mind this I’m poor anyway, but I would like to elevate my standard of living and I would like to travel for leisure one day.
My impression is Singaporeans have no conflict with Malaysians because we’re essentially the same culture but I also know this girl and her family enough to say that they are nothing like ordinary Malaysians. They speak only English at home, no religion, and they believe strongly in independence of women. Her father has spoken to me about marriage and he wants me to know that for banquet and wedding expenses, I don’t have to worry because what can be halved will be halved and for banquet he will pay for his own guests and only his own guests.  
My family on the other hand is conservative and my mom is very “Chinese.” Still places importance in Chinese culture and wants grandchildren very much. My girlfriend’s family has pretty much abandoned their Chinese culture (they don’t celebrate CNY for example). She also has no plans to have children early or at all.
The children issue is perhaps the main source of friction but I am lukewarm about having kids as well so I think I’d be able to ignore my mom. Other than that, my trepidation is in the disparity of socioeconomic class, which I am not socialized well enough to understand the issues that it could bring.
Trying to get some last thoughts. Greatly appreciated.
-
#107857: https://www.nuswhispers.com/confession/107857",,686133480207801,82,112,35,2023-09-06 17:49:20+08:00,2023-09-22 12:00:09+08:00
60535,106963,"Regarding housing, my gf told me she doesn’t want to live in an HDB. But I may not be able to afford a 2 mil three bedder condo. Luckily she doesn’t mind a 1.5 mil two bedder condo. Not all girls are materialistic, it is just how you negotiate.
-
#106963: https://www.nuswhispers.com/confession/106963",,593013362853147,76,160,35,2023-03-30 07:29:42+08:00,2023-04-14 12:00:15+08:00
60693,107325,"My requirement for a guy is very simple. I prioritise physical attributes more than materials. He would be >1.7m, six packs, fit enough to get ippt gold every year, and able to afford a new 3 bedroom condo near an mrt.
-
#107325: https://www.nuswhispers.com/confession/107325",,625518976269252,103,156,34,2023-05-23 10:52:07+08:00,2023-07-14 12:00:08+08:00
