no,cid,text,image,pid,likes,comments,shares,post_time,scraped_at
60283,106462,"I grew up in a less than privileged background. I worked super hard, because my mother told me to. She told me that if I didnt work hard, she wouldn't pay for school. That it.
I slogged my ass off, raffles, then nus medicine. I just worked hard, listened to advice from my peers, and worked. I remember failing multiple times during this process, failing, and getting up, no tuition nothing. and before you think I am bragging, I am not, I am bitter. I am bitter because I had no help during those struggles, those struggles where I saw my friends going for tuition after their fun ccas so they could get someone to catch up with them, and then off for nice holidays after each tiring semester. meanwhile I went home to a crowded home with not much.
in university, my parents didnt even understand the course I was in. They said oh wow good ah doctor. But they didnt understand the stresses I was under, how my peers looked down on me for not being able to get that starbucks every week, or eat the same meal every day (""why you always eat the same thing lol"") no one said anything explicitly, but just people started hanging out with me less... and less.
Now I have a family, small but its mine. dont really have friends from school, just a few work ones who we get teh (coffee shop) together and its surprisingly the highlight of my week. I dont want to have kids because I dont want them to go through what I had gone through.
my mum, she was probably the driving force behind why i cant quit. I now acknowledge its my trying to live up to her expectations and make her proud that I did all of this. I never once dared to show her my failures, or my struggles, or my isolation. Because I was the son she was proud of, I was important in her eyes. and so I kept the path, never once considered seriously dropping out even though I had minimal interest in this medical path.
its 2am and I have just finished a shift. I hope that someone out there reads this and learns something from it. you wil inevitably be influenced by your parents/peers/society. this is something ive learnt that cannot be avoided. but what you can do is to be conscious of it, and to try bit by bit, to integrate a part of yourself in a sustainable way, a part of happiness in your life so that one day you can find peace in the struggle that is your job/career/course.
Have empathy for the peers who seem isolated and struggling, or even acted out in school. Dont write them off as introverts or whatever. They likely just have more to deal on their plates than you do, or you have more social/economic support than them to get through your shared circumstance. Maybe say hi, share notes, or reach out to them if you havent heard from them for a while and say hey, I see you, I know youre struggling, Im going through this with you (not in those exact words but like sometimes just company helps)
one last thing, I would also like to say thank you to that one senior in school who stood by me when things were tough and that it was very meaningful and prob was the reason for finishing the course.
I try to do that now with my juniors in the hospital. Anyway goodnight
-
#106462: https://www.nuswhispers.com/confession/106462",,8545350345535351,972,86,98,2023-01-14 19:05:01+08:00,2023-02-03 12:00:14+08:00
60713,107387,"My husband and I met in NUS and have been married for afew years. He recently started golfing on weekends and I’m somewhat upset cus hes basically gone for half the weekend, like totally radio silence no text no call nothing on golf days. Anyway, one day I decided to prank him by hiding his gloves hoping to see if he will text me to ask if I’ve seen it, but NO he did not text at all, and I found it puzzling cus he complained about getting blisters in the past if he didn’t use gloves. We never ever had trust issues but this actly got me paranoid and worried.
So, the next weekend I threw my air tag into his bag to check up on him. And my heart sank. He was totally not in any driving range or 9 hole but in some random housing estate. I waited for an hour anxiously before deciding to Grab there to confront him. Heng it was a landed property area so I could identify which house it was from the GPS. When I went up to the gate, figuring out if I should ring the bell, someone tapped me on the shoulder and when I turned around, I just blew up. I saw my husband’s best friend’s GF, in PJs and holding random dabao.
Never in my wildest nightmares did I imagine I’d be in such a situation. I started accusing her of monstrous stuff, and how homewreckers destroy lives and shit, and as I went on I noticed shock on her face slowly turn into confusion and then finally into -_-“. When I stopped to catch my breath, she just opened the gate and said come in and see for yourself.
When I entered the house, there my husband was, seated at the dining table, with 4 of his other guy friends, all with their laptops out, playing dota. Long story short, he started golfing after I got mad at him to stop playing stupid computer games as an adult, but I guess everyone needs their own hobbies. Yea…
-
#107387: https://www.nuswhispers.com/confession/107387",,627910656030084,129,55,87,2023-05-27 13:32:08+08:00,2023-07-14 12:00:08+08:00
60533,106964,"As a girl, if im going out with a hunky and handsome and rich guy, then i will offer to spilt the bill. Coz i need to demonstrate that im good catch.
However if im going out with an average looking guy or average income guy, then i will prefer him to take the bill. Coz they would need to show more sincerity
Im cognizant of the fact that i only have 10-15 years of youth till abt 35 to find a gd mate. It is important for me maximise my gains.
Childcare is expensive, housing is expensive. Everything is expensive. Im not being materialistic, im just being practical
-
#106964: https://www.nuswhispers.com/confession/106964",,593013029519847,122,186,85,2023-03-30 07:28:54+08:00,2023-05-04 12:00:10+08:00
60865,107687,"TW: R*pe / SA. Need to ask everyone's opinion here. Also long story but please do read. 
So a guy (Let's call him Matt) and his gf (Let's call her Jenn) lives together. They've been doing good together, until one day, they argue about going to a night club. Let's just say Matt doesn't want Jenn to go to a night club cause he's worried about her safety.
But Jenn insist, saying she'll be just fine. Matt still wouldn't allow it. So they argued a lot. Jenn however, always find a way to go to the club. Either by lying about her location, made excuses, or simply just wait for Matt to fall asleep early. Everytime Matt found out, he'll get mad cause he's so worried about her. Jenn however, continued to do this like more than 10 times, and got caught by Matt at least 7 times. 
Matt is very forgiving, but even he has a limit. The only thing he doesn't want Jenn to do is to go to a night club. That's it. Nothing else. But Jenn didn't care. Matt told her, that if she goes there again, one more time, the relationship is over. Jenn, thinking it's just another chance, simply just go out anyways. She doesn't care anymore. 
Unfortunately for that night, after hours in the night club, she got r*ped and SAed by a guy there. She called Matt, crying, told him everything that happened. Matt immediately drove and picked her up, went to the hospital and police station immediately to make reports and gather all those evidence. Took hours, 
but thankfully, the evidence gathered are clear, and the police said for now, they can go home while they go make an arrest on the suspect. It was very late night at that point. 
Matt, however, drove Jenn back to her parents' house. Jenn feeling confused and asked why. Matt said that he's sorry about everything that happened to her and it's not her fault, however, he's a man of his word. He said that he did warned her that if she goes to the club one more time, the relationship is over. Regardless of what happens, even if she's safe and nothing bad happen, the relationship is still over. Matt did say that if she needed help about the case, he'll help. But that doesn't mean he and Jenn are together. 
He already packed every Jenn's belongings from his house the moment she walked out to go to the club. All of it is in the car, and he carried it for her to her parents'. Jenn, crying and begging, asking him not to leave her and said she won't do it again. Matt however, said that he has his limit too. And he said why does it need for this horrible thing to happen then only she'll listen. Before he leaves, he told her again, that he's sorry about what happened, and that if she needed any help with the case, he'll help. But that's it. 
So, the question is, is Matt wrong for doing what he did in the end?
-
#107687: https://www.nuswhispers.com/confession/107687",,666123805542102,259,202,83,2023-07-31 06:42:37+08:00,2023-08-18 12:00:21+08:00
60456,106812,"To #106787 and those who got their A-level results recently: I agree with Prof Leong. I chose what I loved and studied math. It wasn't even my strongest subject. But it made me more money than the 99.999th percentile of software engineers and I now have enough to lounge around, write these long rants for the rest of my life, and gloat.
I didn't collect my A-levels cert on results day, so I found out my grades a week later. Just didn't like queuing and comparing grades. I was already admitted to the school I wanted, and the admission criteria for physics and math at NUS/NTU were low enough I knew I had my backstops. Turns out I was far from a perfect A-level score.
Admissions advice (somewhat CS-specific):
1. There’s wisdom in ignoring the current market outlook for choosing your career path. The market is extremely efficient, so if a particular major pays well now, you can be assured that it will be competitive and commoditized 4-6 years from now, arbitraging away whatever easy upside you get from picking that major.
2. This negative autocorrelation is already evident now with the tech layoffs - I know many in PE, PWM, consulting, marketing, sales, real estate, design etc. roles who’ve made more than their CS counterparts, with less effort.
3. There’s no free lunch. If it were really that easy to predict which sector would outperform others, you’d make even more money just leveraging your education funds in the stock market than studying in that field. Hypothetically, if you really would’ve had such a positive outlook on tech jobs 10 years ago, you’d have been richer just going all-in on FAANG stocks back then than getting a CS degree. And if you still feel your friends in CS really have better job prospects than you, it's never late to just buy into a tech sector ETF.
4. You don’t need a CS degree to be a practitioner. Incidentally, most of the best software engineers I’ve worked with have other STEM degrees or even no degree. 7th employee at Citadel - physics PhD, code still runs today, and he has more money than Jeff Dean.
5. Point 4 and ""do what you love"" translates into something I train all of my hiring managers to look out for. Which is that a software engineer who did in applied math at a top 30 school is most often stronger than a software engineer who did Course 6 at MIT.
6. Most global optimization problems are intractable, and only some highly-constrained optimization problems are easy. Applying this principle: it's bad to be ""interested in tech"". (I wrote #104647 on this.) Find a narrower interest than that. Even “interested in frontend” is not enough. There’s flavors of frontend: do you like frontend tooling and build, or frontend visual design, or building product flows, or maintaining component libraries? The sooner you can apply constraints in your career, the easier your (wealth) optimization problem. It’s hard to get rich by becoming among the top 100 frontend engineers in the world; it’s easier to get rich by becoming among the top 100 component library guys in the world.
7. I’ve seen many people falsely equivocate “Do what you love"" with being lazy. Truly doing what you love takes more hard work, grit, and determination than working for straight A’s to get into CS, law, or whatever course du jour. Traveling the world is not doing what you love. Writing a book; decorating homes; taking selfies; singing aren't. Doing what you love means getting so good at what you're passionate in that you've become one of the best in the world at it. It happens that I know people doing each of the above who've made 1-2 orders of magnitude more than the average L6 software engineer at Google. My best friend made more money modeling in her 20s than any L7 SWE I know, because she's good at it.
8. Taking a scholarship makes it hard for you to choose what you love. So be cautious. (And please don't be the guy with rich parents who breaks his bond after getting to Oxford, because you're depriving someone else.)
9. Pursuing what you love has ancillary benefits. Chiefly, it makes it easier to make quality friends in your adult life. It's nearly as hard making friends when I had $100 as when I had $100M.
I had lunch with the late Martin Trust shortly before he passed. If you have any clothes from H&M or Uniqlo made in Sri Lanka or Vietnam, you owe it to him. He said one thing that day that stuck with me today, ""I made my wealth selling underwear, so nothing's beneath me."" The man's short, but he stood tall. I heard he was surrounded with family and friends at the end.
Do what you love, and whatever you choose, don't fret if it's beneath your station. Because you'll have so many more ways to find happiness if you do.
-
#106812: https://www.nuswhispers.com/confession/106812",,575672801253870,293,27,83,2023-02-28 08:38:57+08:00,2023-03-15 12:00:08+08:00
60767,107559,"I'm (M30) a rather successful social media influencer. But hear me out, it's not what you think it is.
My wife (F29) is someone who likes to talk about and shares whatever she sees on social media. She'll be doomscrolling TikTok the entire day, frequently sending me videos of influencers showing off their branded goods, having fun at holiday locations, etc and asking me when I will bring her there. Bitch please, I just left my cushy corporate job to start my own business, ain't nobody got time for that shit.
She was getting really annoying so I decided to take matters into my own hands. I decided to start influencing her social media feed. I used her laptop and to google for sports, crypto news, AI news, etc, stuff that I know she won't be interested in, searched for similar stuff on TikTok and started liking and following content creators she won't be interested in.
At first I thought it didn't work, but after a week I realized she wasn’t using TikTok that much and I asked her why. She complained that her feed was really boring and nothing she saw interested her. It was WORKING!
I decided to take things a step further by making her see stuff she's moderately interested in, yet is useful so that they'll slowly influence her lifestyle. She has gained a bit of weight since our wedding but she’s too lazy to start exercising, so I started using her account to follow some fitness and health influencers.
Guess what, a week later she dragged me to sign up for a gym membership together and booked some yoga classes. I’m pretty fit myself so I don’t really need that but I’m happy to see that she's doing something about her health. It has been a few months and she looks much healthier. I'm super happy with the results of my ""social media influencing"".
Guys, social media is such a powerful tool. Do try out ""social media influencing"" on your family/partners/kids and you might be surprised by the results.
-
#107559: https://www.nuswhispers.com/confession/107559",,644200954401054,241,93,83,2023-06-23 12:35:31+08:00,2023-07-14 12:00:12+08:00
60750,107482,"Types of girls on dating apps in SG scene:
1. The ones who don't put much effort, writes nothing much on their bio, and uses their looks to get matches, probably for validation and attention. Examples include ""idk what to write here"", ""hi"", ""entertain me"", ""send me your best pickup lines"", ""idk why am i here"", ""my friend forced me to do this"", ""follow me on ig @______"", ""just for fun"".
2. The ones who are catfish. Pictures includes ones where their face is very zoomed in and not showing their body, or ones where they use some heavy face filters.
3. The ones who are wholesome. Usually has a well-balanced profile, dresses well and are looking for something long-term. Will usually put in effort to showcase their personality on their profile, and effort into conversations.
4. The gold diggers. Bio usually includes things like ""buy me ____ and I will love you"", or ""I'm broke"", or ""hope you can take me out and buy me some good food!"".
5. The ones who are looking for s*x. Usually contains one or more ""provocative"" pictures showing off their body, bios may say they are not here for hookups or fwbs, but who are they kidding.
6. The ones who have a strict height preference. Bios include things like ""If you are shorter than 180cm pls swipe left"", or ""Where my 6ft guys at? hehe"", or ""I'm tall so I need someone taller than me, swipe right if you are"".
7. The ""basic girls"". Includes things like, ""cafe hopping enthusiast"", ""I'm a foodie so I love food!"", ""introverted extrovert"", ""ENTP"", ""aries"", ""love to travel!"", ""shy at first but crazy once you know me"", ""just here to make friends only"", ""I'm shy so you should make the first move"", ""love watching dramas"".
8. The ""looking for security"" girls, but don't really care as much about getting to know you. These girls usually are trying to fish out what educational level you have, what uni you are from, what job or job field you are in. And these are usually done in a way that you can tell they prioritize these, over getting to know what you are like (they may ask this within the first 2-3 exchanges of messages once matched, instead of asking things like your hobbies and interests first). If your answers to their questions are not something that reflects that you can earn a good amount of money, they show quick signs of losing interest to carry the conversation further.
9. The boring girls. Bios are usually short and boring. Their replies lack effort and substance, even if they write on their bios that they ""love deep conversations"".
-
#107482: https://www.nuswhispers.com/confession/107482",,640191944801955,124,71,78,2023-06-16 09:41:16+08:00,2023-07-14 12:00:12+08:00
60246,106371,"For the ladies out there who have never been in a relationship or dating before, as a female myself (25 yo, NUS alumni), I want to share on some important notes before you start dating or a relationship.
1) Actions from guys are more important than words. Yes, a guy may claim he miss you, text you good morning, say will bring you you to xxx, say will do xxx. If they are just saying without any actions done CONSISTENTLY, then it is just plainly talking.
2) Please don’t accept a relationship just because you are afraid to be alone or already in the so called “typical age range to get married” or most of your friends are attached. Rather to be alone than to be in a relationship/marriage suffering!!
Side track: according to book I read, the most important things in life for a lady are:
A) Health
B) Own savings
C) Family and Females Besties (see guy is not in the list)
3) Watch out for his body language. If a guy CONSISTENTLY:
A) Keep his phone/phone screen away from you
B) Disallow you from using his phone
Explanation for A and B: he does that because he has something fishy to hide.
C) Never want to put your couple picture as his dp or post on social media or even discourage you to do so. Delete your couple photos on his phone.
Explanation for C: He considers himself to be in the “bachelor” market. Means he is still looking around for his partner or even scared of people seeing you two together.
D) Always talk about himself and rarely entertain you
Explanation for D: One sided. He only want companionship. There should be give and take.
E) Always online on WhatsApp/Telegram but take 10000 years to reply your messages
No need to explain you should know why.
F) Say “none of your business”.
This is a major red flag. In a relationship, you all are supposed to work and listen together, not one don’t care about the other.
G) Don’t know what he wants in a relationship. Even after months.
H) Flirting and Cheating. When someone flirted and cheated although he has you, it means that your relationship is not that strong enough to begin and typically he will not suddenly change his heart overnight. So please do yourself a favour to distance away from him. Why tolerate someone like that?
I) Always texting a lot of female friends. Go to female friends’ house alone and not with a group of people.
J) Not willing to fork out money for meals/trips on YOU. If a guy is cash stripped because of his family situation (eg. Take care of family/pay loan/debt), it is understandable. Otherwise, the typical guy will always have more than money to spend on you on meals. Imagine a guy having difficulties parting with his money at the dating stage/while in a relationship, and imagine if you were to have kids with him, he definitely want you to spilt/pay for the hospital bills and baby accessories expenses. Would you ever want that?
Side note: a typical guy will chat with more than one girl online/in person. Please keep your eyes open and don’t put 100% heart into the relationship unless you feel reciprocated. Otherwise you will get hurt.
4) I suggest ladies to watch videos from Stephanspeaks YouTube Channel (yes I am a fan of him). From his channel, I learned that a guy who truly wants to be with you would put 100% effort and his heart to be with you. He will be willing to spend money and time with you. No excuses. No mind games. You will be his priority other than his job.
Thanks for reading up to here :). I have been in the above situations blindly until I woke up finally. It has been very heartbreaking for me since I put my 100% heart into it. I cried alot and felt depressed and I am recovering from it now. At least I am thankful for recognising it at the start of the relationship.
-
#106371: https://www.nuswhispers.com/confession/106371",,8503134919756894,267,161,75,2023-01-06 06:48:04+08:00,2023-01-20 12:00:40+08:00
