no,cid,text,image,pid,likes,comments,shares,post_time,scraped_at
60275,106447,"After working for 10 years, I think young uni students need to remind themselves that the industry is nothing like school. People who do very well in school will generally do much better than the average income earner, but there isn’t any reliable metric that we know of to predict how far up the corporate hierarchy you can go based on how well you’ve done in school. I work for a multinational, and the most successful Singaporean in the company, in fact one of the only non-American partner at the firm who is based in Singapore, was a poly student who graduated from Tasmania. One level down, and many of my Singaporean associate directors come from an enormous variety of backgrounds, none of whom did particularly well in school.
In Singapore, it is not uncommon to hear of young graduates from Cambridge or Oxford or an Ivy League university and it is easy to think that the competition is overwhelming. In reality we honestly don’t know how well these people will do. Being a very good student comes down to two things, natural intelligence and discipline. At work, many other traits are rewarded. It isn’t an asset to be sociable in school but the managing director of sales at our company made 700K last year. I worked on her team for a year and our job was primarily talking to customers and building relationships in the industry. Nothing technical. In school, if you’re the most technical person you’ll end up at MIT; at work, if you’re the most technical person it is rare that you will make management. If you do make management as a genius engineer it would have been for reasons other than your engineering skills.
Success in the world of business is even more varied. I have met owners of a small family business that make close to a million in profit every year from just managing rental properties for landlords. They clean, they market, they find tenants, and they earn a fee from doing it. I have met a marble dealer who made 2.5 million profit last year. I meet a lot of business owners because of my work in consulting.
It’s fine to be proud of scholastic achievements. It’s fine to pursue it hammer and tongs. But know that the world is enormous and people are rewarded for many skills and traits that many people would deem useless.
-
#106447: https://www.nuswhispers.com/confession/106447",,8534831933253859,244,15,57,2023-01-12 19:36:14+08:00,2023-01-17 12:01:41+08:00
60254,106390,"Behind every CLEO most eligible bachelor or Mr international Singapore whatever, hides a story that only people who interacted with them know.
For instance, a particular CLEO bachelor. I was in a project group with him. Long story short, he's a leecher. Leeched like the world is gonna end. Don't turn up for meetings. Don't do his work. Don't provide inputs. Basically MIA all the time till the last few days when we were about to present.
Excuses ranged from hall activities to ccas, relationships and what not. Voiced out to him but he said got legit reason. Got another project presentation blah blah. Eh hello? Our project also quite big ok. Level 3 module project 40% of total course work. Now he join some CLEO bachelor. I kept rolling my eyes when I see his face around. If he's the eligible bachelor then I really worry for his future gf or wife.
-
#106390: https://www.nuswhispers.com/confession/106390",,8518635521540167,26,13,2,2023-01-09 15:42:19+08:00,2023-01-16 12:00:41+08:00
60272,106440,"Just something that I thought might help people who went through or who are going through something similar:
I am someone who went into a relationship rather quickly, I don't consider much so long as he fit my criteria and the feeling is mutual. Right now, I am in a healthy relationship myself and I would like to share with people that it's easy to recognize a toxic relationship after you take a step back and see it from a third person POV. I am pretty sure when people are in a bad relationship, they too know it as well, be it whether you have invested too much (like my case before), or you don't love yourself well enough and hope that someone will save you (also my case). After ending a few relationship that's bad for me, I realise what those have in common is each time a break up happens, I am the one who's begging for them to return to me, which is very degrading for myself, I put them in pedestal and forgot that I am someone who's deserving of love. I wasn't in a good place to receive and yet I kept giving till there was nothing good left.
Most of my friends can see that those relationships are slowly eating me away and yet I couldn't see it myself, I invested way too much emotionally, and I got comfortable to a point that it wasn't good anymore. Cheating, emotionally abuse, especially the latter, isn't something that I am familiar with until I read up myself, it got you to thinking that maybe, there's something wrong in myself after all.
What I hope to put it across is, don't be afraid to step out if you find yourself in a toxic relationship or you suspect that you are abuse emotionally. Walk out, and I can guarantee that it may not be on the actual day that you will feel it, but weeks or months later, you will feel that it's easier to breathe, you will be smiling more.
I met my current boyfriend on dating app and he's the best that can happen to me after I have cleared my head well and being in a emotionally well place to receive love and also, to give love. He's everything that my ex isn't, he calls when he says he will, he sends me home late at night even it means he has to cab home himself, he stills do those things that he did when he woos me, basically his actions speaks volume. He's still the same as he is from the start till we are a year into the relationship now.
To everyone who's suffering in their relationship, walk out now, and I hope that your next relationship will be the one that makes you smile more.
-
#106440: https://www.nuswhispers.com/confession/106440",,8534825476587838,54,10,10,2023-01-12 19:34:41+08:00,2023-01-17 12:01:36+08:00
60266,106421,"I am an alumni in the workforce.
The best time to start was in primary school/secondary school/junior college/polytechnic/university, the next best time is now. Alternatively: You have to start somewhere/Rome was not built in a day.
I call bullshit on the above. I don't think aspiring beginners for sports who are in the working world should think about even starting, unless there is a really good suport structure/programme to enable them to develop, and I sure am not aware of them(I guess my radioactive attitude would not help even if they did exist). I guess that matches what someone else told me about how, in the (working) adult phase of life, it is on consolidation of competencies, not ""exploring yourself/your interests"", because apparently you are supposed to already know them.
Maybe it is a mismatch in expectations, alternatively it really is hopeless to bother as an adult with commitments from career and family (and NS). I see some sports that others looked like they were doing since before they left the education system to various degrees, and they have related/adjacent experience on top. Some of them caught my interest, but I don't see how I can start, or even if I do, how meaningful it would be. Yes, discovering that a sport might not be my cup of tea/what I thought it might be is one thing, but how far should such attempts at trying out, if possible and available, go before the call to stop is made?
I definitely did not do sports in the above-mentioned stages of the education system. Schools I was from, they were play to win. And I feel like a klutz on land, so forget sports like soccer, rugby, tennis, badminton, frisbee, etc. I did get the certs to say I would survive a ship sinking scenario, but that's it.
As for why I would like to pick up a sport, because I feel that running down the NS Fit counter and attempting the IPPT only to fail is not a sustainable strategy long term. Guess I'll just keep to this way until I start having to default.
Maybe I should be angry at myself for not seeing earlier that this was something I might have been interested in, but did not know where or how to do it outside of what I already had, which did not include such sports.
Or maybe I should blame my parents for not marshalling me to do such things beyond the 'bare minimum' of certificates to not drown and/or not putting up the resources to do such things beyond those survival swimming awards.
TL;DR: Too late to start such sports I feel like I might be interested in, or at least I don't see (any hope as) how to as an adult.
-
#106421: https://www.nuswhispers.com/confession/106421",,8524308637639522,2,5,0,2023-01-10 19:32:10+08:00,2023-01-16 12:00:56+08:00
60258,106398,"To Dimples, who was my favourite person, sorry I lost my temper that night. The truth is, at first, it was really just for fun and nothing serious. But those first 3 weeks of texting everyday, making me laugh and saying goodnights got me attached. After awhile, I told you I liked you a lot. Thank you for handling all my brutal honesty; you always know what to say in awkward situations even when I'm drunk texting you. But things changed, from bad to worse. I tried really hard to even be a friend. Because I wanted you in my life but I always got told to fuck off, so finally I did. Maybe next time I'll use my brain more and less of how I feel. Anyway, I just really wanna say sorry and wish you well. This is so generic but since I have no ways to reach you, I hope it finds you. From K $3000
PS. Bit tipsy. But it doesn't make everything I say less true. I do miss how nice you smell.
-
#106398: https://www.nuswhispers.com/confession/106398",,8518639531539766,9,5,0,2023-01-09 15:43:56+08:00,2023-01-16 12:00:36+08:00
60268,106423,"Current undergraduate here. I see there is a water polo team in NUS - teamNUS Water Polo. I remember mention of a recreational team in Semester 1. Does anyone know what it is like? Are they still accepting members for the recreational team?
I also see there is an academy for adults by SportSG under ActiveSG. I have credits I can use, but has anyone participated?
If I want to try out water polo, which one should I go for?
I cam swim without issues, though speed and strength may be a concern given how fast-paced and how powerful the throws in waterpolo look. Many thanks for opinions/thoughts/advice!
-
#106423: https://www.nuswhispers.com/confession/106423",,8524309630972756,5,2,1,2023-01-10 19:32:25+08:00,2023-01-16 12:00:57+08:00
60280,106457,"#106448
The most important thing that you have to do is accept that she is gone from your life forever and forgive yourself for making that mistake of letting her go. Once you do that, things will start to fall into place.
Of course, it is easier said than done as i am also struggling to do so - letting go of my first girlfriend whom I broke up cos I was bored and wanted to date other people. I tried to chase her back when I realised my mistake but it was too late. I was devastated when I found out she chose the other guy and heartbroken when I found out she decided to marry him. Leaving me with nothing but regrets, memories of our happy times together and unrealised plans/dreams.
If you have not done so, try to practise self-forgiveness, telling ourselves that we made a mistake and should move on. Because life is too short to look backwards and time travel has not been invented yet. Living in the past does no one any good.
And if needed, to take a break from dating others so that you can reset/recalibrate your requirements for a partner. I regret not doing this as I tried to numb my sorrow by jumping prematurely into another relationship which resulted in more regrets and drama. I regret not recognising that it is okay to be partner-less.
If your emotions/thoughts becomes too much and overbearing, sometimes it is good to let it all out by writing. It doesn't need to be coherent. I do it during those troubled nights to release those dark thoughts.
If all else fails, I recommend counselling - although friends can help to listen but sometimes, speaking to an unbiased and new person really helps. The paid options aren't cheap but there are free ones out there which may not be as good but hey, you can use the money saved to treat yourself.
Overall, be kinder to yourself. We all make mistakes and we should learn to forgive ourselves. Sometimes, our regret stems from us not being able to forgive ourselves. And doing so, may help us heal and finally move forward in life. I hope to reach that state one day and I wish you all the best in your own journey.
-
#106457: https://www.nuswhispers.com/confession/106457",,8545349268868792,20,1,4,2023-01-14 19:04:42+08:00,2023-01-17 12:01:40+08:00
60282,106460,"hi anyone applied for advance nus bef and got in? every year how many is accepted?
-
#106460: https://www.nuswhispers.com/confession/106460",,8545349618868757,0,0,0,2023-01-14 19:04:47+08:00,2023-01-17 12:01:37+08:00
60265,106416,"I am convinced the medical library is not so much a library as it is a coffee shop for the librarians. Dropping books on the METAL shelves, banging carts around, talking in loud voices with not one sense of self awareness. Please leh.
-
#106416: https://www.nuswhispers.com/confession/106416",,8524305954306457,5,0,0,2023-01-10 19:31:38+08:00,2023-01-16 12:00:55+08:00
