no,cid,text,image,pid,likes,comments,shares,post_time,scraped_at
61156,108295,"I was days away from my proposal to my ex-gf. She has this avoidant dismissive personality. She dreams to be a tai tai and I have no issues with that. She recently quit her job and wanted me to temporarily support her. I couldn’t provide much but I would offer to pay for meals, etc. on top of that, she expects me to pay for almost everything because she’s “not working”. We often quarrelled about money because both of us have very differing views about money. To me, money is just like a commodity, it’s plastic. What’s more important is the experience we spent tgt. One day, she told me that she would feel more secure if I were to put some money with her. I was super hesitant but one night, thinking that I would spent the rest of my life with this girl (days away from proposal and house paid for already), I trf her everything I had >$10k and only kept $1k for my own expenses. 
The very next day she wanted a break up and insisted that the money was a gift to her. In my WhatsApp message, I had explicitly stated that this money is for our wedding, house, Reno, etc. 
I really want back the money and think that she’s a gold digger but she claims she isn’t. Can anyone advise what can be done?
-
#108295: https://www.nuswhispers.com/confession/108295",,735403901947425,64,114,27,2023-12-03 14:12:20+08:00,2023-12-14 12:00:14+08:00
61154,108290,"I’ve been tgt with my bf for 10 years and I basically wear the pants in the rs not bcs I’m the domineering one but my bf mindset is not the kind that would plan ahead or would just decide on anything so naturally, I have to volunteer doing all the planning etc. However, just awhile back my mum told me not to rush into things as she started to have a h2h talk with me and really felt like my bf isn’t ready with his finances and career. Even tho, we’ve been tgt for abt 10 years, I felt like my mum wasn’t approving of him like his phase in life becos he took the longest track which is ITE, Poly and then Uni. So by the time he grad, he’d rly be close to 30 alr and haven’t started working but I’d have accomplished much more or maybe even job hopping to get a higher pay raise which I would then feel the imbalance and the difference. I do see him in my future and that was why I want to get a bto first with him but now, her questions are ringing in my head, will I end up being the payor of the house? Or mostly everything? Meals? I need to take care of my mum and my grandma sometimes.. I can’t afford to foot the bills whenever I’m with my bf. We haven’t talked abt this becos whenever I try to communicate with him, he always brushes me off as he’s afraid of the future too and just says “if it happens, then think later”. Sometimes, his attitude rly turn me off like I don’t feel he loves me as much as I love him but he might also be feeling v stressed over sch and stuff.. I just want some assurance and then there you have my mum saying all these trying to make me have second thoughts on this man. What shld I do now?
-
#108290: https://www.nuswhispers.com/confession/108290",,735403748614107,29,72,16,2023-12-03 14:11:58+08:00,2023-12-23 12:00:08+08:00
61165,108320,"would someone be willing to explain to me why are some girls so shameless and disgusting?? going after a taken guy and requesting him on social media knowing he has a girlfriend .. sitting beside him during staff dinners and photos like you are trying to stand a chance?? 
i have always been a girls support girls person but this girl is getting on my nerves these days. I have never met someone like this before and i am fumbled by the audacity of this person's behaviour. 
Can someone advice if i should genuinely be concerned about this or just let it go. My boyfriend on the other hand is someone who likes attention and has hard time saying no but he does tell me when i ask and does not lie (sometimes) . I have not been in a rs since 2017 and this is my 2nd rs in my 20yrs of living and this is my first time encountering such experience. 
My boyfriend also used to kept his ex gf in his spam acc without me and lied to me by saying that it was only for the boys and that was the reason he could not accept my following which i found out, turned into a huge fight .. he was sorry bla bla and we got over it. I got over it because i saw that he actually posted me on his spam acc altho i dont know why he could not accept me?? 
There was this one time when i went out to eat with him and as i was getting up to queue for his food, in that span of time he liked someone's picture while i was beside him and he was cranky the whole time we ate.. this hurt me alot btw but i did not said much. 
idk if my bf is the problem or my overthinking is the problem. and that girl that have been snaking around his workplace trynna get something from my bf.. what am i supposed to do wit her or just let them be. 
or would it be the best to leave this rs and js focus on my studies since whatever this guy can provide for me , i can provide for myself 3 times more.
-
#108320: https://www.nuswhispers.com/confession/108320",,744267871061028,40,60,16,2023-12-18 23:21:40+08:00,2024-01-03 12:00:17+08:00
61167,108322,"Writing in for some advice because I’m feeling very lost. To give some background, my parents don't have the perfect relationship but they get along quite ok. My mum said that she chose to marry my dad even though he was poor, because he was responsible, honest and hardworking. So fast forward 20+ years, he has been a good father and is very good to us. However, recently he has been going out late at night, which he says is to drink with his friends to destress due to work stress. But he has also been behaving weirdly and paying alot of attention to his appearance. I was getting too suspicious so one day i decided to look at his phone (i know its wrong) and saw that he had a whatsapp chat with a young woman, and their chat were just quite flirtatious, like asking whether she was ok because she drank alot etc. after reading it i was really hurt and disappointed because i hate cheating and would never condone it. But i am also not sure how to move forward because my mum relies on him and i know that this will hurt her deeply. I just feel so helpless and dont know what to do. I cant even look at him in the eye now even though i had a close relationship with him before, i dont think i can respect him anymore
-
#108322: https://www.nuswhispers.com/confession/108322",,744268107727671,41,59,4,2023-12-18 23:22:08+08:00,2024-01-02 12:00:19+08:00
61168,108326,"I like reading about so called intellectuals trying to quantify their version of success. It really scares me that almost everyone use money as a form of benchmark. Is that the hallmark of a Singaporean? 
A bit of me. I was once extremely smart. I didn’t finish my education properly only because I got unlucky with my roll of dice of life. I get to mix with a lot of people. That’s when I realised there’s 2 groups of people, street smart and book smart. You can get yourself educated up till PhD but you probably still can’t understand how to make the best out of the people under you. At the same time, I know of hardworking individuals who became millionaires through their businesses. 
I’m lucky to have met so many smart individuals. I know of a Physics prof who is so cool and laid back. He didn’t care if people think of him as a stupid person. He didn’t feel the need to flex his PhD. A random person on the street will probably think of him as a normal ah pek and he’s chill about that. He’s definitely one of my idols. 
One thing I learn in life is that there are many versions of success. What is success to me is probably not success to you. Despite having only A levels, I was lucky enough. I was able to accumulate a wealth of almost a million in under 5 years. Lucky because I sold my HDB flat and got onto the nice bull run a few years back. I was also quite involved in a gig job that pays me $10-15k/mth. 
I had a simple target, 1m for retirement. Once I hit that, I got out. And yes, lucky again, because after cashing out, the market crashed. I was lucky that I bought a lot of crypto investments that didn’t fail. 
So am I bragging? Partially yes. The main point I wanna focus on is not being greedy. I’m all set for retirement at a young age because I don’t really chase money. I enjoy the process of investing and I was careful about choosing the right product that resonates with me. The profit is just a byproduct. 
One thing I learn about investing from my ex colleague is to earn money, you shouldn’t be obsessed with money. Focus on the process, and you’ll eventually make money. 
That’s when I went back to school. It’s so cute to see my schoolmates being obsessed with As. They just love competing for the best grades. On the other hand, I enjoy seeing some others helping each other out. These are the real talents. There are too many smart people already. Kindness is a rare virtue these days. These students will have a lot of friends supporting them on their way up. 
As for me, I’m just finishing my studies here for the fun of it. Took my fav subject just because. Gonna be $30k poorer which probably won’t increase my income further. Being educated allows you to earn more but most probably didn’t realise that being educated doesn’t make you smarter or better than most others. There’s no need to quantify and rank accordingly. 
If you wanna be rich, do business. Most don’t have the guts to do it anyway. Everyone likes to think they are special. It’s only right for them to feel so. That’s how you will feel purposeful in this world. 
For me, I’m still enjoying my life eating prata with my teh tarik. That’s how I like to enjoy most of my time. Annual euro trips is mainly because, she wants it and girl math, it’s cheaper to buy luxury goods there than in Singapore. 
Personally, I’m just enjoying my time listening to as much music as possible, watching concerts, watching movies. I’m just enjoying that I have the luxury of time for all these. I have friends going on yachts and such. Like I say, different people have a different version of success. 
For me, my version of success is being as healthy as possible to live a long life and having all the time in the world to do things that I like. Time is more precious than money, only because your time is finite and time will even become more precious tomorrow than today. 
It can be quite intimidating hearing the thoughts of highly intellectuals. I guess not everyone can enjoy their rich lives. I’m just happier doing my own things at my own pace. Tbh, I have no idea what’s my next move after graduation. I’m considering giving back to my community. I think that’s probably something that I’ll want to do next. 
 Most important of all, I’m just thankful to be born in Singapore. That’s the biggest luck factor that allow me to ‘succeed’ in life. You can argue about Singapore being too expensive, but it’s worth it! And that’s exactly why I believe Singaporeans are all successful in their own different ways. It’s just scary when intelligence and wealth are being used as a form of benchmark for individuals. 
To end, I believe luck is the most important factor in your life. Being born in Singapore. Being born to a good family. That’s luck too! Sometimes, you can make your own luck. Put yourself more out there, do things outside of your comfort zone. Keep on trying, and you’ll test the boundaries of your luck. My friends always tell me that I am very lucky. But deep down, I know that I’m a go getter. You miss 100% of the shots you don’t take. Just enjoy life for what it is, ffs! May the odds be ever in your favour.
-
#108326: https://www.nuswhispers.com/confession/108326",,744268244394324,107,40,19,2023-12-18 23:22:27+08:00,2024-01-03 12:00:22+08:00
61152,108286,"Advice needed ‼️
I have known this girl since secondary 1 and had gotten closer to her after secondary 4 when a three person friend group was formed (2 guys 1 girl). It has been 6 years since the friend group was formed and we are very close to one another where we will often meet at least once a week.
However, recently, I started having romantic feelings towards her and this is where it gets troublesome. I am not sure whether I should pursue her/let her know how I feels or I should just keep my feelings to myself.
I feels that she will never and has never looked at me romantically because we have been friends for such a long time. Also, she always tends to look at good looking guys and have like a kinda high expectation on the guys she will like to date but I am definitely not that ideal guy. I really feel that I do not have the chance but do still want to let her know how I feel about her or at least have her give me a chance to pursue her.
BUT! What if after I shared my feelings to her… will we still able to be very close friends like before? Will the friend group break? I cant afford to have this friend group to disperse as they are very important individuals in my life.
What should I do?
-
#108286: https://www.nuswhispers.com/confession/108286",,735403655280783,12,40,4,2023-12-03 14:11:40+08:00,2023-12-11 12:00:07+08:00
61159,108299,"Happiness is a state of mind. 
You just need two basic meals a day. [Yes two meals, three meals is too much and u will get the widespread obesity we r seeing today]. Everybody can afford the 2 × $5 meal a day
Clean air which sg has and provided for free (unless u r stupid enuff to buy the  air purifier bs)
Clean water which sg has (unless u r even stupider to buy water purifier bs)
Free wifi which wireless@sgx provides
You don't need 5c.
Almost all degrees holder can Get min 3k pay
Primary school and sec school and jc r free.
Hdb bto 3 room flat is very affordable.
Basically life in Singapore is good. Sinkies should be grateful
-
#108299: https://www.nuswhispers.com/confession/108299",,744266254394523,50,38,5,2023-12-18 23:18:17+08:00,2024-01-02 12:00:08+08:00
61166,108321,"AITA?
Husband was a boyfriend of 6 years before we got married for 5 years. I just had my motorcycle license when I first got together with my boyfriend. 
He didn’t have  the need to take one because he was against riding. We used to argue and take public transport instead of us riding because he kept insisting it isn’t safe. He felt anxious on the bike until years later when he got used to it. He then said it’s convenient to ride than taking public. He used to tell me not to split lane so I tried not to whenever he was my pillion. 
When covid strikes and he was out of a job. He took riding lessons to work as a grab delivery rider. Now that he has his motorcycle license. His comments about my riding got worst. Telling me I am a reckless rider and he doesn’t feel safe whenever he was my pillion. Like excuse me? You rode with me for 8 years before you own one and never once you commented that and now I am reckless? My way of riding never changed. 
I got upset with him. Like why would he say that? Why would I want to put his life in danger? Why would I want to put my life in danger? It doesn’t make sense. I told him I wouldn’t want him as my pillion anymore. He could ride his own bike and I will ride mine or whenever we are taking only one bike, I wouldn’t want to pillion him. He told me I got defensive and he doesn’t understand why. Now he is upset because I got upset at him being upset at me. (If you get the drift) 
It is super annoying. He doesn’t have a driver’s licence but each time I drove, he will keep commenting “Why I don’t give way? Why must I drive fast? Can you please be careful.” I WANT TO FOCUS ON THE ROAD ALSO CANNOT LA! 
I told him off. Now I told him, get your license. I am not driving anymore. You can drive all you want. He is upset with me and ignoring me now. AITA?
-
#108321: https://www.nuswhispers.com/confession/108321",,744267947727687,18,32,1,2023-12-18 23:21:50+08:00,2023-12-27 12:00:12+08:00
61163,108312,"December has always been a difficult time for me. Friends going on holiday with their loved ones, couples being together, families being together. But I'm just reminded with how alone I am with no immediate family and no one to love.
I want this year to be different. Any recommendations on how one can feel less isolated this holiday season?
-
#108312: https://www.nuswhispers.com/confession/108312",,744267331061082,40,32,4,2023-12-18 23:20:25+08:00,2024-01-02 12:00:11+08:00
61146,108276,"So there's this boy at school I see often. Let's call him X. X is a pretty good-looking boy and he's smart too. As for me, I would describe myself as someone who's slightly above average in terms of looks? Well, I pale in comparison to the rest of my classmates. Anyway, I'm a y1 in and X is in yr 2. We met during our CCA and ever since then I've been incredibly smitten with him!!! How he was the first one to talk to me when nobody else bothered to, how he checked in on me on whatsapp, and how he comforted me during a tough period in my life. OMG I RLLY CANT TAKE IT. IK HE'S SINGLE RN BUT I OSO DW TO CONFESS TO HIM SINCE HE'S HAVING HIS FINALS. BUT I ALSO CAN'T STOP THINKING ABOUT HIM. We still do keep in contact frequently, though not as much since he's busy with finals. BUT IM PLANNING TO CONFESS TO HIM AFTERWARDS. Where should I go to do it? AHHHH I REALLY DONT KNOW, HE'S JUST SO CUTE, THE WAY HE REACTS, THE WAY HE SPEAKS, AND THE WAY HE TALKS, THE WAY HOW HE CARES ABOUT ME SO MUCH. IK HE'S SINGLE RN AND I REALLY DW TO WASTE THIS CHANCE. I'd be really in the dumps if someone other than me grabs him. Then again, I do think I may need to calm down. Since, I did stalk him a little...to the point where I know where he lives at. BUT THAT'S ONLY BECAUSE WE TOOK THE SAME BUS COINCIDENTALLY AND I JUST FOLLOWED HIM ON IMPULESE. But I did learn my lesson from all that so I won't do it again, probably fifty percent, maybe as a surprise I can show up at his doorstep and say ""Hi I didn't know u lived here, I saw u going up this lift and somehow I found out we're actually staying quite close together(lie)"" AHHHH I DONT KNOW. ANYWAY I NEED SOME TIPS! HELP!!!!!!!!!!!
-
#108276: https://www.nuswhispers.com/confession/108276",,735402491947566,10,31,4,2023-12-03 14:08:59+08:00,2023-12-12 12:00:08+08:00
61147,108277,"(lengthy post ahead)
At the age of 22 in 2020 (Year 2 NUS Female), my mum had depression, which prompted my dad to quit his job to take care of my mum. Since that year, I was silently forced into the only breadwinner of the family. While studying, I took on part-time jobs and internships while studying to save up for allowance, give my parents some money and save to pay for my tuition fees. It has been very tiring but I endured throughout.  I did not tell friends about my situation and they thought I was just hardworking. By the end of Year 4, I have 4 internships including a long term part-time job that made my resume stood out. My sincerity and hard work landed me good testimonials written by my  Managers from my first 2 internships. 
Fast forward to Dec 2021, my last internship was a nightmare to me as my supervisor was very overbearing, I cried a lot silently and bearer her throughout. I cannot quit as it was a graded FYI. Towards the end of the 4th internship, there was finally light at the end of the tunnel. That was at least something I thought! I was thankful to have found a FT job shortly after I graduated from NUS. For the sake of money to provide a better living for my family, I accepted the  FT job immediately. The pay was 3.5k (average pay for my degree). Little did I know it is just a beginning my nightmare.
My immediate supervisor  micromanaged me a lot, scolded me a lot and didn’t give me face when scolding me in front of other colleagues. My reputation went down. The only good side is my reporting officer is very understanding in his words. Nevertheless he still side my immediate supervisor as she is a top-performer in the company. Throughout 1 year plus, I lost weight and dreaded work but I cannot quit for fear that my family income will hit 0 as the only breadwinner in the family. 
Concurrently in Jun 2022, I met my first love through my childhood friend and we got together in Dec 2022. He was someone who I can turn to about family issues and has similar goals and values as me. Whenever I felt so tired from working and carrying family burden, I endure throughout the weekdays and weekends have always been my greatest pleasure to hang out with him.  He was just like my best friend and a reliable partner. I treat his parents as if they are my parents. Whenever I have nice food, I would bring it over to their house to share. 
Little did I know in Feb 2023, I realise he has been cheating on me all these while and worst of all, his family and that childhood friend  who introduced me to him have known about it and had been hiding the issue from me. I have never felt so hurt in my heart. My world came crushing down. He apologised and and I forgave him. Then a few months down the road, I discovered him seeing another girl again. I blocked him and he came to my house to apologise to me. As I was kind-hearted, I choose to forgive him and let it slide. The last straws were:
(1) Caught a random bonquet of flower at his house. He cannot explain what the flowers are for and his mum has to jump in to “cover up” for him. EPIC fail!!
(2) He brought me to a friends’ gathering session and openly checked out other girls. Neither did he introduced me to the rest, I was left transparent there!!!
(3) Lying about his whereabouts, only to find out he was going on dates.
In Jun 2023, I mustered courage to totally cut off from him and walk away. It was never easy, he came back sometimes to check in and I just ignored him. 
I was low key disappointed because when our mutual friends (from other clique) knew about the breakup, they sided him. They obviously did not know about his cheating affair and chose to side him. I felt that there was no point for myself to fight for my say since they don’t believe me.
Currently in Nov 2023 (25 years old, female), I decided to take my power back. Having minimal friends doesn’t matter, what matters is that I have my own back.  What keeps me going is still my obligation to provide for my family. I am still learning, but I would never give up. I have been attending counselling session to cope with my feelings and situation. What doesn’t kill me makes me stronger.  
Thanks for listening.
-
#108277: https://www.nuswhispers.com/confession/108277",,735402518614230,292,30,9,2023-12-03 14:09:05+08:00,2023-12-15 12:00:07+08:00
61158,108297,"Would appreciate some advice on this situation. Basically, I know this guy from school who is very good looking and many girls swoon over him trying to lock him down. Initially, I thought he was a very nice guy due to his mannerisms and things he say but after talking for a period of time. He suddenly stopped replying me and before that a guy friend of mine told me that he will just talk to me to keep me interested before ghosting me one day once he gets bored. This turned out to be true and a few weeks later this guy dropped me a text asking me how am i doing. I'm just wondering if I should even reply him because the last time he just disappeared like that, i felt really bad and feel that he wasn't very genuine in forming a true connection even as friends. Like we don't have to talk everyday but at least a heads up would have been nice... Like it really sucks to be ghosted and left second guessing about yourself
-
#108297: https://www.nuswhispers.com/confession/108297",,744266124394536,14,30,0,2023-12-18 23:18:04+08:00,2023-12-26 12:00:07+08:00
61160,108304,"TLDR: What should I focus for the short/mid term in my career?
Hey guys, NUS alum here. I just recently moved to a new tech co as an entry level DA earning 8k+ per month. I started my first job 3 years ago earning below 4k per month so I consider myself quite fortunate to achieve this current level of salary.
Recently, I have been feeling a bit troubled knowing that my job title is still an entry level while my some of my peers have climbed up to senior or even assistant manager level. They started working at the same time as me and have stayed in their co since then while I have changed jobs for a few times, most recently due to retrenchment.
The thing is, I don’t foresee staying in my current job for long as I’m not passionate in the industry my co is in. I signed on simply cos it’s a no-brainer to have a well-paying job in today’s economy rather than being jobless like the past 4 months for me. I was even ready to settle for less salary to work in a role I am passionate in.
So with all these things considered, what would be your career advice for me? One option I’m considering as well is to go for a career break to study a master degree. I feel I shouldn’t delay it too long or else I won’t ever get it.
-
#108304: https://www.nuswhispers.com/confession/108304",,744266734394475,12,30,1,2023-12-18 23:19:16+08:00,2024-01-03 12:00:13+08:00
