no,cid,text,image,pid,likes,comments,shares,post_time,scraped_at
58109,102237,"Just wondering what kind of family do y'all think would try to convince their future daughter-in-law to sign a prenup agreement?
My fiance proposed last month and we talked to both sides' families as well. My parents were overjoyed but i kinda felt offended when his parents brought up the idea of a prenup agreement. My fiance currently earns slightly more than 1.5x of me and his parents will be leaving him $60k for his future once he turns 30. With that said, his net worth will probably be 3-4x of mine. I just finished paying off my study loan whereas my fiance was blessed enough financially. His parents said that in this era both man and woman should contribute equally to the household. Here comes the irony: when i asked whether my fiance should also contribute equally to household chores and raising the kids, they said that it is a woman's job. Tbh shouldn't the party with more money contribute more? Do they expect me to give birth to the children, feed and take care of them and also contribute equally to the household expenses?
I'm really not sure whether they view every woman out there as golddiggers. I'm a pretty frugal person myself and do not splurge on luxury products. The only branded stuff i have is a pair of chanel earrings i got for myself when i graduated from university. Most of my meals are from food courts and i rarely visit high-end restaurants. Throughout the 5 years of dating, my fiance has never gifted me anything that costs more than $300+/- (except for the proposal ring). Because of this he was able to invest more money and he even said that he was thankful for me as his friends often complained about having to buy their girlfriends dior/chanel/iphones and bringing them to expensive restaurants or cafes.
How should i convince them that it doesn't seem reasonable for me to sign the prenup agreement?
-
#102237: https://www.nuswhispers.com/confession/102237",,7048148148588919,39,184,10,2022-03-04 06:39:26+00:00,2022-07-08 11:58:50+00:00
57608,101248,"Tldr: I think I ruined my parents marriage and feel guilty.
I'm 30+ this year and was a bully back in primary school. No excuses. I was an asshole, idiot, dick... Back then, I made the unlucky mistake of picking on a rich boy, whom we shall refer to as Q. I didnt know Q is rich, which primary school kid knows the concept of rich/poor? Q accidentally fell and broke his arm.
The school called both sides' parents down for counseling. Q's dad is some high flyer in the private sector and did not have any intention of mediation. He came to inform my parents that he intends to file a civil lawsuit, claiming medical expenses and damages to the family, he also showed us copies of medical reports. My parents pleaded on the basis that
1. They were willing to pay for the medical bills (private hospital somemore)
2. If the verdict is in Q dad's favour, my parents wont have money to pay him anyway, they would be bankrupted and Q dad wont get the money either way.
3. My mum was an office admin and my dad was a taxi driver, they don't earn much.
Q's dad looked straight at me and said ""I'm not after the money, I have money. I'm trying to teach you a lesson."" It has been 20 years but I will never forget his look. He was out for my family's blood. My dad caned and screamed at me that night.
The lawsuit ruled in Q dad's favour. We had to pay for our own lawyers fees, his lawyers fees, the medical bills and Q's dads loss of income (he had to take off work few days to counsel Q). Thank god it didnt bankrupt us but it devastated my parents' finances.
They controlled me extremely tightly after in sec school, which contributed to the strained relationship between my parents and me. Their relationship also began to change. My mum began calling my dad ""useless"" or not being able to earn money or ""have connections"" or being ""only a taxi driver"". Parents divorced almost 10 years ago.
This guilt is eating me. Had I not been a dick, maybe money will be ok. Maybe my parents will still have their marriage. I am not the same person I was 20 years ago, but my family is still feeling the effects of that ""punishment"". Isnt the punishment disproportionate? my family is broken up over what some stupid primary school students did? How is this fair? just because the other side has money? Q is prolly over it and leading a good life. I cant help but think the rich really know how to turn every situation into their advantage and bully us normal people.
-
#101248: https://www.nuswhispers.com/confession/101248",,6731107076959696,130,183,88,2022-01-12 00:25:12+00:00,2022-05-22 23:22:16+00:00
58854,103636,"I succeeded in chasing a girl way out of my league and now getting cold feet. Should I tell her honestly and pull out?
I’m with this girl for a few months, let’s call her J. I was initially very attracted to J’s good looks and well grooming. I’d say her looks are among the top 10-15% of all the girls I met. Despite being an average guy, I planned and chased her and won her heart after some time. However, as we spent more time and knowing each other better, I realized there is indeed a huge gap in lifestyle and abilities between J and me
- J lives in a big semi d landed house while my family lives in a old 4 room flat. Her dad owns several successful businesses while my parents are average income workers
- Her social skills are top notch and she can talk to ppl and make friends easily across age groups and nationalities. I don’t make friends easily as I don’t reveal myself too much to strangers. I also have problem’s especially dealing with ppl with power and knowledge like bosses or professors.
- she is an active sports person and her body is very fit. I’m slightly chubby, although tall. I don’t have a toned body and often struggle to pass my IPPT.
- she is fluent in English, Chinese and german, almost to the native level. I speak singlish most of the time and can’t even write standard English or Chinese well.
- Her CAP is 4.6x while I am 3.1x.
There are many other things too. I have asked J what attracted her to me and she said it was my integrity, sincerity and kindness. But I know that integrity and kindness alone can’t sustain a relationship. My confidence drops a little every time I went out with J and know more about her. We are still in the honeymoon phase but she may start comparing me with other guys once the honeymoon fades. I have heard many examples that it just won’t work out if the guy and girl are too different. Even if she can accept me, her family would disapprove such a guy due to the big diff in SES. I’m thinking to take some pain now and just break off instead of prolonging smth that prob won’t end well.
-
#103636: https://www.nuswhispers.com/confession/103636",,7420480751355655,136,182,47,2022-05-25 06:17:34+00:00,2022-10-18 02:27:46+00:00
57295,100431,"My gf and I have been together for nearly 3 years now.
We met in an orientation camp during our first year and I am 3 years older than her. She is from Malaysia and does not have much friends here so she spend most of the time hanging out with me. She isn’t exactly the “goddess” kind of girl. She is the girl-next-door type that you will easily fall in love with. Good-natured, cheerful and sweet. She smiles a lot. She is tall for a girl, at 174cm (I am only 178cm) and very slim. She is tan as she likes to swim. She wear her hair in a simple bob at chin length (till recently), which she trim once it touches her shoulder. She told me she keep the same hairstyle since primary school. She dress simple, T-shirts and shorts most of the time, or T-shirt and Jeans if attending class. She doesn’t put on makeup.
I like her a lot because she is very understanding and doesn’t have high expectation (of me). Unlike my exs, she does not expects nice and expensive gift from me. Sometimes she cook and pack lunch for me. She really cook well. She never complaint that I play computer game a lot, and she sit quietly at the side when I was having a game of basketball with my friend. She doesn’t go clubbing but she never complain a single time when I went clubbing with my buddy without her. She never flare up and never a harsh word to me. She don’t expect me to do anything for her and will even volunteer to help me run my errand.
At the start of this year, she start visiting me at home during weekends, and she will stay for dinner. My mother likes her because she is very polite, help in the house chores and she help makes dinner whenever she was here. Then one time, it getting quite late and my mother ask her to stay for the night. From then on, she stay over every weekend. We start to have sex. Surprisingly she is very active, unlike the demure self in the day. I can’t help but notice how skinny she is, and wish that she can put on a little more weight.
So every weekend, we live just like any young couple, study, watch Netflix, going to buy groceries, meals, sex etc nothing special. But I felt blissful.
Then something changed a month ago. She always followed me to the malay barbershop downstairs, and wait for me to get my haircut. But this time, she wants to cut her hair too, I was surprise and told her I can bring her to a nice salon. She said its ok as it here cheaper here, and moreover she want a shorter cut which normal salon don’t do good. So I watched helplessly as the barber cut a good 10cm of her hair to a boyish cut that revealed her ears. If it was cut in a salon, it will pass off as a pixie cut, maybe more feminine. I don’t like it and told her to grow her hair long. She just smile. My family members are surprised by her haircut too. But my mother was all praise at how sweet she look even with such short hair. I can’t believe my mother actually encourage her.
Anyway, after this incident, I become conscious of how Tomboy she look and dress. I get annoyed when my female friend teased that she looked great and will fall in love with her.
So the last straw. Last week I went for my monthly haircut, she said she wanted a trim as well. I told her No as she supposed to grow her hair long. She said just a trim as the hair at the ear is sticking out and keep persuading me. Finally I agreed. So after my haircut, she sat down on the same chair. She converse with the Encik in malay for quite a while and the cape was put on. To my horror, the barber start to use a clipper and dig deep onto her nape and high onto the back of her head. I exclaimed that it shouldn’t be this short. My gf however assured the barber it’s ok and urge him to continue. I get really angry with each pass of the clipper. The final cut is a neat man haircut with closely clipper side and back. The top is no more than 5cm and well combed. My gf can easily pass off as an army regular anytime. I was so angry I cursed at her. I keep silence the world day without speaking to her. At night, seeing that I am still angry, she offer to have sex with me. While we are at it, I can’t help but keep seeing the closely clipper part of her head. It feels weird on my hand and I lost interest. I feel like I am having sex with a man.
It’s been a week since I avoid her. I know its only hair and it will grow, I should not be petty as a man. Moreover she is such a wonderful girl. But she lost all her attraction to me and I can’t kick away the feeling that I am dating a man.
I know I am the jerk to be thinking this way. I am blessed with such a wonderful girl as my gf, but at times I really wished that she is more curvy and well-endowed; and doll up a little.
-
#100431: https://www.nuswhispers.com/confession/100431",,6335199983217076,92,181,102,2021-11-06 23:25:27+00:00,2022-05-21 20:03:07+00:00
