no,cid,text,image,pid,likes,comments,shares,post_time,scraped_at
61105,108205,"Okay, brace yourselves for the saga of my not-so-secret twin telepathy. So, my twin bro and I used to be attached at the hip—literally, twin perks, right? But as the years rolled on, it turned out our telepathic connection got a bit wonky. Cue the plot twist: he spilled to a relative about our sudden 'distancing.' Shocking, right?
Now, here's the tea I've been sipping on for years, and surprise, surprise: turns out, he's been spreading rumors that I'm on a mission to steal his snacks, blaming me for his 'food disappearing act.' I mean, yeah, guilty as charged, but seriously? Also, apparently, I'm the 'mean sister,' and he's been broadcasting this to anyone with ears. Classic sibling drama year? But fear not, for I've embraced the art of self-love and the magic of building resilience. I've quietly transformed from Snack Thief to Independent Queen, and it's been a wild ride. Fast forward to today, when I catch wind of his legendary trash talk, and I just hit him with a nonchalant 'Thumbs Up, Man!!' Because why stoop to drama when you can rise with a thumbs-up emoji?
Maybe I'm low-key childish too, but hey- Senpais, any better comebacks in your bag of tricks? Enlighten me, wise ones!
-
#108205: https://www.nuswhispers.com/confession/108205",,723653059789176,0,12,0,2023-11-11 22:39:45+08:00,2023-11-15 12:00:14+08:00
61096,108182,"So I just started working in a new job this week. Today was my 3rd day at work, and my manager asked me to create a slide deck to summarise a research paper. So I worked on it and at 1pm i gave her update saying that I will submit the deck either today or early the next day. She said she needs it by today, so I said ok. At 3pm she asked me when I can have the slides ready, I told her by 6pm, and she asked me why it takes so long. I was confused since I interpreted “by today” as end of day. Then she told me that if she didn’t give me a deadline, I should just ask for it. I informed her that I did try to align the deadline with her, but she responded by saying that she needs time to review my slides. And she even went on to say that while I need to ramp up on knowledge, she wants me to start contributing asap. 
Firstly, is it wrong of me to interpret her initial deadline as end of day? If she didn’t give me a specific time to submit the slides to her, am I supposed to read her mind? Was I wrong in this case?
Secondly, it’s my 3rd day on the job. The research paper was new to me and I don’t want to produce a copy-paste job just to submit it. I had to digest the source material first, and at least give a thoughtful summary no?
This issue has bothered me quite a bit. Her tone was not friendly during the exchange (completely over Teams chat as I was WFH). Should I clarify or clear the air with her when we next meet in office? My first impression of her is that she won’t take any feedback well. Or should I just live with it, and potentially she will do something else I deem unreasonable in the future. What should I do to continue working with her?
-
#108182: https://www.nuswhispers.com/confession/108182",,723651139789368,2,8,1,2023-11-11 22:35:21+08:00,2023-11-15 12:00:13+08:00
61104,108201,"What do you all plan to do after retirement to stay active and healthy even after retiring? Do you believe it's still important to have a passive job to ensure that your body and mind remain active and healthy? Additionally, in your opinion, what's the best country to retire in and why?
-
#108201: https://www.nuswhispers.com/confession/108201",,723652796455869,1,7,0,2023-11-11 22:39:10+08:00,2023-11-15 12:00:13+08:00
61093,108175,"After meeting people from various walks of life, I have come to realise the distinction between contented and secure individuals versus those who are not. Often, the former is a significant factor contributing to a person's success in life as well. Many have heard of the term ""mindset"" and how it shapes an individual, but it's essential to recognise that one's mindset reflects their lens on the world.
Have you ever been quick to judge someone or overly critical of them? Perhaps the individual in question is ten or twenty years younger than you and appears to possess material items that you couldn't have attained ten or twenty years ago. As a result, you might be quick to assume that the person received a gift from someone or that it's their parents' money, and you treat them based on your perspective, which stems from a sense of scarcity. However, someone who could easily acquire similar material possessions might not perceive them in the same way, as they share a similar position in life. This is because they view the world through a different lens- ""half cup full"".
My point is that when you approach life with a perspective of ""been there, done that"" or ""I can do it, I have it,"" you'll find yourself resonating with like-minded individuals. Conversely, when you view the world with a ""half-cup empty"" lens, you'll constantly find issues with people or things around you. This perspective can lead to a self-fulfilling prophecy because when your brain consistently sees things in a certain way, your thoughts can shape your actions, leading you to attract and surround yourself with similar-minded individuals.
So, the next time you're tempted to pass judgment or be overly critical, take a moment to consider your perspective. Allow space and time for the benefit of the doubt. 
This is more of a ramble, but it reflects my personal thoughts based on encounters with many such people. I hope this topic sparks some reflection and contributes to making the world a better place. Thank you.
-
#108175: https://www.nuswhispers.com/confession/108175",,723650816456067,9,2,0,2023-11-11 22:34:51+08:00,2023-11-15 12:00:13+08:00
